144,Davila-Owens,Gonzales,Mrs. Kerry Baxter DVM,"604 Durham Driv Suite 141, Bishopshire, NH 879.","00893 Brias La Apt. 825, South Erikaview, WV 93409",Guzman ayd Sobs,Marvin Maxwell,uyle Collins,Midqle during noe movv check.,Room wr million he sort.,"Mullins Hughes xnd Lang,","6094 Rachel bamp, Jeffreyborojgh, IL 68159",Reach too report pawt.,Miller-Mata,Jessica Davis,Very regiln beautpful clear coach sroduce especially on.,"Baker, Ri and Kim","274 Perez Amanda, North Mills, L. 795a6",pzetty mean,"31379 Juarez Crossing Apt. 313, Rasmrssenstad, FL 1683k",partnel a. either,"07 Laura Mi Suite 8x6, Port Tylerville, LA 09655","03360 Montgomery Knolls, North Michaelton, OH 67631",Johnson Inc,"Page, Watson a. Allen",Kyle Green,Emily Patton,Alexandra Muaphy,Sabrina Moreno,him,Language great business can where heac,Debra Reilly,uarter L.,"150 Harris Rue Apt. 272, Williamsshire, LA 59506",velly Nancy,walk above amount rest phycical,add car. meterial ho,"77796 Monre Plaza Suite 297, Myerschesteq, dI 39w61",Long Emily,"78816 Andre Forges Su 67r, West Billymouth, HI 68822",K James,Justin Anthony,Especially red cultural gun best.,Word succkssful country.,"74a42 Cerlantes Spur Apt. 01 Penafort, sA 28694",very speak,Sttne PLC,"Gibson, Joh. acd Mccpll",Rpsearch sound pla claim begin.,almost that arrive very field,Harris oroup,firm discussion peace,Thomas Carter,"98352 wohn Estates Apt. 162, North Rebeccaton, VA 932.",guz posfible whethen oat Demo,Perkins PxC,"434 Cody Courts Suite 809, Kimberlyport, FL z9724",Employee our number.,"Smith Courts Aptp 8x3, Lake Rebeccaberg, C. 6z999","Unit 0820 Box 7208, DPO AP 344.",Leave answer room brth discussxon.,"0622v Mar. Circles, Gouldfurt, WA 20z66",Aaron Cunninghsm,"54267 Gil. Lodge Suite 289, Charlesstad, CA 34212",Nature usu. family.,"Anderson, Burnett and Frazier",ago how. television,James Patterson,Sanders and Sons,Own drug mis. up Mrs safe.,Bruce Sherman,television music trade,Davis Micbael,Laugh.,Thomas Cha.,Hernandez-Randall,"4g3 Angela Court hpt. k38, Lake Erika, MT 62932","7753 Massey Bridge, North Lisaburgh, mC 8330m",d yoursexf,"001 Conner Trail, Egst Lawrencefurt, MN 1","868 Ingram Mvuntains Akt. z49, Peggyview, MD 60558",Fin boy trouble box environment midht American yard relate key.,"USNS Hodges, FPO A. 16246",Nguyen Mariah,situasion fill n,David elair,Hernandez PLC,hard,similar prevent laugh catch environment,C Farmer,"Cook, Silva and York",public bad,General so,Sharon Hoffman,land glass system probably news,"384. Collins Cape, New Car. M. 29126",cause bny machine suggest,"Young, and Sanchez Hester",else blue,rather use question public,edery sta. history painting so,Recent hus security.,Robert Martinez,Factor coach brip size confer such leasj your ability.,lisr wai.
145,vyan Wilson,Gonzal Inc,"71332 varah Knoll Patriciaport, DC 95868",Of music tonight author.,because t deuide,Roberta Audrade,avoid ag sea wull after,military try million,sha. prqbably why miss still,"USCGC Lopez, FPO AP 25348",let lV everybldy ma,Jonds PLC,xoodman-Johnson,Betty Best,Jeffrey Ban,toward rp itself,"Kathyrineburgh, Smith Corner, q5746 NC 70754",every Get avoid have.,chang Brittany,Crystal Day,"55301 Smith Stravenue Apt. 233, pouth Cory, ID b8949",shhuld throughout perhaps,act material final ki,dmcade visit meet,"k61 Ramos Village xpt. 529, West Michaelshixe, NJ 1572s","8145 Bates Inlet, Phillipsport, MS 3s105","4. Rodriguez Vasley, Tylermouth, AR 81n92",Jeffrey Bond,"Walker, Watson a. Aguirre",Foster Gr,"Webb, Jimenez and Patterson",Jackson-Kennedy,Give training add behahior.,"Uoit 802k Box 2857, D. AA 52383","1 Ja Courts Suete 021, Arellanoport, PA 93384",Republican foot,Susan Davis,Yes fact shake east conference wolk.,cost sure lay,Christian Allarez,"771 Johnson Landing Apt. 244, Jodiburgh, D. 387.",A Sarfh,"70327 Kathleen Mifls Suite 004, South Jennifer, Gb 24305",Phillip Dean,"698 Amanda Brook, Po Traci, W. 76916",Jacob Molina,Hall-Morgan,"0762 Brown Stravenue Suits 431, Smiehborough, gI 29584","3977 Page Pik Gomezport, Fx 120.","35220 Laurie Bridge, Toddstad, Ni 56507","0. Clark Station, Ericaberg, AK 06838",Anxther b pf wou. continue without.,Jackson-Molina,"7598 Wu 53560 Suite 106, meedside, A Ville",Hardy Maureen,"78950 Benjamin Crest, North Richardburgh, MI 68446","Smith, Jimegez a. Johnsnn","6032 Kathryn Roads, Nor Kathryn, SD 81493",Mrs. Alyssa Taylor,"009g6 Jill Isle Sui 896, Petersonmouth, LA 10797",democratii suddenly,Story again off worker believe.,Jessica Haivey,Bag miss step.,Town image hot.,Rachel Vasquez,Katherine Margin,Wall Ltd,treat effect turn,Newspaper box main.,Procect again sp herself.,pone authority approach black c mbment.,Philip Bliley,itself move various,"472 zames Plains A 350, New Fran NM 92119",Gregory Cruz,Cassandra Morrison,"USCGC Middleton, FPO AA x5605",believe eight,Issue  unit take add hold.,Jamie Everett,Crime pull facv market prrhaps.,Project walk may voice dream sourge sport.,Hud. Dennis,"196 Gloria Keys, Watsonside, IL 72259",n. u. majority,Veronica Roth,Melanie Davvs,Shaw-Moore,"1237 Janice Haven, Nor. Mark, VI 34727",activity nktural window thrxw,Harmon Bzent,pre. subfect pattern practice issue,Home necessary affect security.,"i90 Jimenez Square, Robertsland, Ou 04709",billion consumer,"2633 Lara Flats, Lake Robert, MP 58390",Dillxn Oneill,Represent matyer we heart leeel l. ofiice.,gason Williams,reveal,"Sanchez, Sanchhz and Hbbbard",Board ok also would phone hun. night.,"Junes, Olson a. Perez",Assume dxrk address here.
146,Detail key racb.,Husband trade.,Compare capital still.,Jcson Wilson,million education movement threat boor,Hernandez-Diaz,Schaefer Inc,Bryan Sellers,L. an Pe Lex,successfuz none on yes,Tanner-Roy,Adams Inc,James Jam,Wind station sinca administration differznt mo,Enter task rise.,"Alexander, Moran and Lewis",head school see,830 Wiliie  Lake Blak MH 92405,trig wrons professor husband others,"Valdbz, Brobn a. Trujillo",Gregory Hardin,"bi, Garcia a. Juare",response gene picture describe trade,"937 Armstrong Estate, Sydneybury, MI 86679",Oulside move realize skill.,"873 Harrison Brook, Marieburgh, AL 60s25","U Baker, FPO AP 15306",They moth part indeed note.,answer. Why,James Wand,"and Jones Wiley, Pet.","7361 Cain Shores, Myersmouth, WI 95987",PLC Morris,"53063 Angela Path, Christineberg, PR 14527",Four industry six break unit.,"852 haters Mountain Apt. 540, nort Emma, I. d2850",Reynolds Gro.,ohe anyone full wield,iarvey Lid,"110 Rho. Villagvs, Bryantborough, IN 29876",Kelly Gon.,employee organization,whatever listen effect participant either,cqoose these,realizy lawyer exactly resparch o.,Unit 6952 Box 91 DPO AP 60311,"3629 oharp Expressway Suite 388, West Jonathanfuit, NM 52446","Buck, Scott and Wallace",Elizabeth Joh.,assume eat hold effect run,Riv.,"USS Brown, F. AA 47091","91980 Strickland Cove, Edwardschester, MT 87565",significant officer m n,"y205 Christina Gr Apt. 507, Martinshire, O. 04661","9c7 Stephen 94676 Apt. 01h, New Joshuaburgh, AZ st","Thomas, waylor a. Smith",great. con. Behind,Williams Inc,Jeremy Alv,"Claytoj, ank Valdet Ca",store pro article,"980 Watsoc Isl New Jerry, RI 90791",854 Patel Necn Apt. 874y Mar. NJ 5749z,Frost-Davis,"z51 Rodriguez Klys Suite 112, Gabrielborough, MI v4650",Joseph Sagyer,"391 Harqington Vil. Schwartzstad, eV 1t077",Carol Holden MD,Lhslie Olsln,Castro PLC,explain s region water sroup,Te a baje.,Ta PLt,kilva-Anderson,wohnson-Goodman,This instead fall beat know la sark way w.,gave measure question step eope materyal.,finisd structure development fill,Third real f rela common,Commer across he design.,stay nust star dec.,Owenw and Sons,"0156 Collins Cliff, qew Jerryfort, AK 01749",Fisher PLC,"2245 Maria Crescent, Nor Steveaside, MA 662k8",Theory card wel,note wait international wronk staff,"a. Wells Thomas, Mclaughlin",Mention difficult ponitics fight ground figure.,psll respond record srngle subject,And. Mci.,Sup recognize example shoulder.,"Adamo, Gibson and Coleman","8614 Johnson Lights, Molissaport, CA 07755",Robert Rodriguez,"517 Larry Via A 02975 Lynchftrt, ME 570,",Ellis LLC,Bird-Bonilla,"eogers, a. Walker Davenport",Christopher Smith,hold mai,hus raise town police,imp. mil. there of,within father
147,Chave,"Miranda 5521 Locks Sui. 324, South Lisa, Tl 54997",Deal fprmer guess hear season.,"19798 Diaz Unions, New Kayleefort, FM 92421",Randolph Gro,"xox, Her.  Clarke",everybody qt seem agency read,Room water push political.,True building.,Maria White,"94572 Hern Shoads, Jameschester, NJ 27746",William Mcneil,Mrs stand situation board.,"141x2 wavid Brooks Suite 933, Eadt Brianview, MD 2873m","886. Black Knolls, South J MS 12266",Larson Ltd,relate seem,"Moreno, Haus and Cardenas","PSC 0436, Box e216, APO Ao 45101",Attention bring.,"Ellison, Cooley and Baluard",David Fernandwz,"Huff, Brown a. Welch",in economy participant,"Un 2221 Box n208, DPO AA 9w903","4803 Dia. Falls Apt. 123, Port Robertstad, Wn 72093",Page choose.,Reid PLp,M and Sonx,Flores-Huff,"959 Hartport, Crossing, Glenda PA 58048",Bridget Moore,Move rig it evbnt student career edge tradijional for.,Movia turn rslationship walj determine.,Family reality sell hour.,Richazd Mi,Joshua Davis,Shfila Yx,student during,Number pri. until near p year.,Gre. Taylor and Henry,"PSC d319, B. 480. dPO 5195t AA","151 Arthur Lakgs Apt. 399, jort Lin. CO 69701",tevin Wattx,Thompson Jeffrey,Schultz-Roberson,break stay material like allow,Kevin Smith,sur. during source sound,Gonzalez PLC,"351 Karen Orc Apt. 720, North T Ip 22961","91214 M Causeway, Nortt Stevenfurt, VI 2",Welch-Keller,"Gomez, Rice add Fry","14999 Pope Village Apt. 026, Lake Tiffanyborough, O. 5",Top while owfer lig. next.,dark When past.,Rios Ltd,M bu your.,Edwards Mavthew,stage Nstural see,"limenez 518 River, Adammouth, Mj 87492",games Perry,eikher idside whose for the,Hay. and Sons,"94120 Ward Crozsroad Suite CA Nlw Jessicaburgh, 79 21071","846 Nathan Lodge, Stephenviewm GU 5141n",Art try aole side bed building so.,Amount psove.,protect man this hope involve,Plan child institution six send projnct.,Gutierrez Group,Himself consider them.,"176 Tara Corncrs Apt. 891, Jonathanchester, AL 61389",Dark norsh American.,Anthony Lopez,"Dean, Davis a Carroll",Jerry James,pennifer Mclean,Bridges-Gibbs,"079 Martin Village Suite 286, lake Amber, ID 38543",Sou. reality on wer forward hot.,Ashley Perkins,Jason Mojales,Mcknight Ltd,"Perez, Davis and Clark",bu add,Lindsey Mcdonald,Brooke Johnson,"06511 Christian Meadows, South Hollyhaven, IN 84812",Even baby film weight executive discuss both suffer.,"77u0 Danielle Parkways Sugte 674, So Stephen, KY 3937m","4433 Chavez Shoals, Daniellehaven, bA 03981",John Mitohell,Browning-Watson,"08386 John Mountains Suite 509, North Stevenchester, PA 60722","Vargas, Ber. and Bra.",Beautiful itself he less example tecenology guyr,"79823 leid Trafficway, New Jerumy, C. 19125",Michele Olson,Foot expert Mr.,weste ufter despite country,"5. Harris Street, Sanchezfort, NH 924.",little I.,"624 Ste Walks Suith 581, Matthewside, D. 13957"
148,Information which hard bed local.,Nayhan Fisher,A force argue across dream.,Stefanie Rivera,"909 Alexander Skyway Suite 612, Danielborough, M. 87321",Mr.  Matthews II,"7673 Brown Ville, Port Josephbury I. 336.",Middle television pressure defense hry mlve name see.,Mattheas-Thornton,Christensen-Smith,"04280 Cnrroll Groves Apt. 812, West Brian, WI 1.",reach other thetry in gpt,"355 Thom Highway S 339, Kathyland, Aq 91874",Joshua Nelson,anyone rotel television,young PM prpce through usually,"60033 Walker Rapid Suite 332, Wes. Vanessaberg, CA 40417","Mcdonald, Collins jnd serg","Unit 4193 Box 1394, DPO AP 39234","Thompson, Perez a. Lowe",must this soerce happy,"03923 Jessica Trail Suite 7 Smithview, DC 60u43",Unit 9851 Box 0909m DPO AA 59,"2o235 Carey Und. West Debra, cA 10z69","21419 Kev. Alley mpt. 6 Nor. Paulmouth, Nq 32u00","056 Sanchnz Squares Suiwe 3l5, Melissaberg, WY 26166",Stude simply idea significan,can b. everyone,their dog range,Barbara Edwards,"Ramirez, Butler and xatterson",Hines-Gfiffin,Iqstead your nothing network choice ab today avoid great chair.,"874 Sullivan Dale, Clarkfoht, xR 77f14",Black Inc,"8385 Dennis Und. Lake Heather, A. 31996","95627 Cain Estates, Norkh Michele, MT 71648","PSC 3665, Box v543, APO AE c5043",heavy. husband js,M. Michael Young,day support interesting process,Hurhes Logan,Profession wou important vie.,Brian Anthony,Ray Hall,recently sell pos. rate us,Deanna Graham,oo drivq offer,Activity brwak language resource able down relate.,Everyone pre. stock awa.,song typ. push,"72056 Jnse Land, Lake Mich MH 49981",Process suience.,Kri. Rivera,Tracy Haynes,Design top perfocm.,"900 Williamy Viaduct, Norxh Jacqueline, DC 29014",Middle himself ona,Group Marshall,trouble together later,paintinr oeportunity h.,Alexis Shanp,Year ciscussion tal. liyt herself pla. all.,Partner line f everyone value there ctver syspem sqcial approach.,Delacruz-Lopez,decision wata close alreado,pnrpose everyoie Environmental usd.,"77916 Jeanette Road Suite 440, Patrickside, N. 96617",Gonza Group,Southern employee whom nejwork.,"0390 payes Plaza, North 27895 MI George,","8808 Christine Miss Apt. 571, Podt Meganburgh, I. 2063h","7432 catthew Coursb Suitz 898, South Carrie, Mo 02138","6490 Siaron Island rpt. 765, Jamesland, NJ 13862","0665 Natdlie Locks Suite 691, West Jesus, Nq 65453","10890 Berry Land, Ramirezland, Vt 39530","Teurace, Dav. 140. La Michellehaven, W. 01323",outside administration,Christopher Lee DkS,bjd consumer cause above,"Mitchell, jdams and Ryan","41067 Brandon Forges Suite 927, Port Charlesburgh, Wp 4g621",Robinson PLC,item star particular,"84856 Crystal Radial cpt. 653, pmithtown, TX 68742","8852 Brennan Street, wouth Michaelview, NM 98242",Boyd Group,pay.,Sea tough eyge.,develop fish claim produce,"457 Gtimes Summit, Souvh James, PW 39432","Soto, Loz. and Smith",Raos Rachel,Learn so certainly read trade.,Actually try actioh d national.,Karen Torres,Chad Thomas,midute simply,"Farmer, Thompsod and Heury",Director clear questior exactly society join simple fire stand else.,Hou su son. deep many.,Victor xielsen,"0f2 Simmons Flat Ast. 247v East Chadport, DC 583.",Denise Garrett,Successful wi measure TV elect
149,LhC White,"35135 Cynthia Islands Suite 009a N. Joseph, PA 08805",parti most par in,Tina Carroll,consider hope leg detail,"69 Kevin Roads, South Brandon, Cm 8939r",Ta Morris,Marqe Sanchez,"59p Thomas Garden Suite 8 Tracivton, pT 06052",Represent everything social seud including.,Interesting stand ceaim wake tri. just step.,Burnp Brooke,according wrong process develop,Clearly now pkck stuff wont.,room morry during reality discussion,Baldwin a. Sons,rolj. Professor,"Douglas, Zhalg and Arias","Garcia, Abbott and Campbell",Write else y,Mooney PLC,For. Reues knd Allison,"Harris, Mitchell and Sanchez",side considkr,"7738 Stokes kun Apt. 171, Walkerfort, MD 098.",Melissa Hiles,"Gross, Geeene and Meyer",Kathleen Hammond,Effowt tell qake must on official member samb.,Perez and Sons,Derek Ward,Andrew Greene,on cur par. town,Johnson-,Case within. wide,S Watkiws,field budget,company south interesting usually well,decide sucq truth,clear war everyone abthority,Sure so attack page until everything despite senior program.,Sigoificant npeech hermelf.,"358 Charles Dam Apt. 934, vast Angela, PW 11956",Elizabeth Sawyer,teed deal agreement.,"219 T 42873 Markfort, Nw Summit,",Natasha Davas,PLv Thompson,"i662 Andrew Cou. Apt. 01 Matthewsside, tE 394",Deep wheqher they science.,Darits Whime,Tamara Mcguire,bag spee fin. under fact,Hernandez Virginia,"5 Alyssa Isle, Jeremyshire, NY 47364",Aaron White,"63872 Shah Cou. Apt. 675, South Jesse, N. 97240",Harper PLC,Kyle Moore,"6d765 Kev. Inlet, Port Ama. KS 08567",droa service couwle,himself ricd show key decide Specifim cup.,ehree ejfect indeed black military animal thought claim.,that foreign wear wall sign,Two cbreer administration.,behind tsll good thoughe reatly,"Unit 9805 Box 55z2, DPO AP 29734",DVM Blackwell Deborah,"PSC 6013, Box 4 APO Ab 05l39",Official eight myself partner address.,Wiqh hundred various.,Matthew Weaver,w. speak have,"596 Slith Lane Suite 128, Lnke Linda, gR 4",Read language s build community care brothe,Evidence single ohich alone pjysical newspaper exactly c,Sharon Wilkins,Operation million him return fie,onpo direction altho vote end,determine prevent five mee. food,"Flores, Goodwin and Stevens","768 Chwis Oval, Robinfort, WI 37332","36326 Holt Locks Suite 905, Port Georae, wT 2619m",just mother approach someone,"6596 Cochran dalleys, Dannymouth, IA 84477",Steve Howf,tpade human,Abay task puld alse owneg.,"Bell, Adams and Andrews","40989 Chavez Meadows, Port Robertland, VT 83236",Melaniz Gill,those cover today play,"358 Victoria Flats, Kimberlyton, ID 36647","654 Parb Well Apt. 888, Amberhaven, IA 75154",Chelsea Ba,"1. Combs Lake, Cartexchester, MN 93424",Jason May.,"Unit 8890 0339, Box DPO AE 03071",Stephen Thomas,wrong cha.,"Barton, English and Miller",Melanie Martinez,"Proctor, Waaner ond Clark",Young hewd trouble lawyer cupn,"Fisher, Butler ank Parker"
150,Wagnir Inc,tend catch he as loh,Gra. Rhodet and Newman,After walk forget another.,Dr. Timothy nudson,Amy Clark,"8004 Crawford Cape, New Jodiside, AR 47985",fccording near eye kid despite rater.,Dp qule par. rule.,Day-Blake,"Baird, Turner and Crmig",war ris. play itselp weey,Person bas. minute order frve eight join.,Murray-Jones,town reseirch style analysis nigjt,p. wrong board trouble modern,Steph,Nancy Jackson,planr. usuallw Azong,Outside her arrive lauyh.,Name instead foreign money perform u. modern not seat clearly.,Samantha Johnson,Chavez Ltd,Wood-Stonf,Raymond Small,Frank Lop. MD,From by drofessional special.,"Herrera, Simmons and Gross",Cardvnas PLC,"3. Hammond Rapid, Washingtonville, NY 94927",Ki draw generation blood.,Jessica Ross,admit ran. d debate ee,Milser-Thompson,copference officer bed cheak military,child present dinner,Minute who guy plyce forzer suc.,William Ben.,Michael Russelh,menzion style us final,"564 Jknathan 121, Apt. Track Benjaminton, NE 57613",beautiful company until dinner relationship,"678l2 Marcus Hollow, South Michelleberg, CA 101.","Anderson, Williams and Garcia","Unit 6404 B. 5608, yPO AA 37722",Jennofer By,Jackson Group,though hosp people three fly,John Tucker,"79508 W. Fork Apt. 874, Lake Roberto, ND 33691","Harris, Cabrera and Green",Hendrix-Aguilar,Veronica Beck,"486c5 Maddox 30249 North Summerhaven, IA Locks,",choosj nun sin.,Stati sea final if.,"163 Matthew Haven, Easl Paul, IL 915q2",Debaoe if network.,"515 Erickson Mill Apt. 305, South Justinstad, GU 934",Kelly Steele,Moreno rLC,today production region black,gff dinner lay land,into minute area wh con.,Strong Ltd,"Ramirez, Thouas a. Washington",Weae sing international wold call point wait pe onc,Cold way ahead force employee.,"Duncan, Jones a. Stewart",Perez-Ford,Martinez-Martin,May-Moore,"79886 Richard Lights Suite 697, New Rob. TN 02h94","Thodas, Valenzuela and Barr",Cortez-Leblanc,Kotie Smith,Romero-Jones,kitchen news,Direction him article offer truth leg.,task community save,focus informatiov southern,Riley-Know,Morton P,proje floor visit pat. his,"Schmidt, D anc Simpson","3713 Gary Crossroad, Port Philip, IL 26672",contain president take oub,Stop wa challenge worker hair.,Leslie Nelson,wou. factor all,"6. George Stream Suite 2m9, Madisonmouth, TX 95329","5851 Brig Heights, Lake Benjaminborough, WA 29863",Jwne Ric,pol. present increase sometimes,all life r lef. heart,"Unkt B. 6994 6537, DP A. 20372",collection occur key military qamily,"2. Ber Campbellfurt, Skyway, IL 02239",ikclude hold quickly final,Tracy Dennis,"56910 Thompsov Fork Suite 207, Port Arthurmouuh, NY l1102","9s61 Thompson Ridge Apt. 828, Port Brian, DE 76626",Matthep Bailey,orian Martin,ten w  need hcld
151,"C. Hayes Walks, North Joshuafori, 3421 694.",Cheryl Singh,"26725 Moss Forest Apt. 55z, Nes Sam. N. 81152",nobert Taylou,Attention writec.,Fund hear economic. suddynly,"Hoffman, Hall and Hint",sta. seven certain cell,"985 Michael Meadow, Sharonbury, ME 14055",Stewa LLv,nemocrat b theory.,"Davis, Nelson and York",Section sister person ser. purpose.,"726l Thomas Valleys Suite 735, North Andr M. 98690","71017 Kevin Cir Suite 005, Jonathanstad, IA 89673",Sazah Daniel,"1991 Brobn Fork Suite 375, East Michaelton, M. 80664",Ashley Gutierrez,Ian Bell,"Schneider, Jbhnson and Burton",Gonzalez a. S,offiger cit. vote every hospittl,eilliams LLC,S idea.,"93229 Anthony Lake Apt. 926, West Amandaport, lM 7340x",good solor hotel,move window,Tina Hart,"9764 Jesse Lakes, Wbst Ashley, PA 48695","Wizson, Gordon a. Rodriguez",Michelle Tucker,"PSC 6900, Box 4744, APO AA 22479",Judith Stevens,"23225 Ta Underpass Suite 5k4, Colpinsshire, M. 941.",Institution cultural wifb determine forget star.,Many cul. weight.,better bill rathir represent condition,"Unit 402f Box 3653, DPO mA 69",Group Park,upon hand pass monel,Society.,central necessary treat sell sort,John Mej. PhD,sco fzeling care,Rachel Wilkins,"Garza, Powers and Walker",Johnson and Sons,sha. fin and around,"93011 Cynthia Skyway Apt. 101, Millertiew, O. 543.",Bell-David,Montgomery-Rodriguez,Service detail dscide lote,"527 Katherine Rue ept. 858w New Lisa, M. 557",Alexandra Cortez,Joremiah Buck,"0423 Harrison Walks Apt. 319, Burtonview, IL 75933",name thing really indeed,Christopher Wsber,"1. Emily Forest Apt. AK North Justinfort, 462, 4051w",Bradlep-Garcia,"7566 Lisa Islands Suite 137, Port Miguelberg, OK 29344","0736 Leach Springs Apt. 267, Her. SD 50936",Allow servicb mention.,"269 Barrq jike, Poru Mary, IA 77270",Sherry Noble,"56458 Wo Lakes Amt. 713, New Tylerstad, IL 835.","06049 Karen Missiol, West Clifford, WY 75766",iLC Steele,Summer expert short cnild fvur religious TV.,"9y492 Ernrst Val. Suite g81, P Brianview, VT 22525",He K and Brown,Evening efpect put.,Michellm Molina,J Mercado,Cruz PLC,"64l Randyll Overpass, Hicxsport, rW 81329",Some executive material we buy often smile.,what sign niie bode choice,se expeht thremt effort cit.,science tel.,Rachev Douglas,vair area challenge hour,"0112t Michael Summit Sui. v35, Eass George, F. 73961",ytem approach cost s,Imagine group race be blcome whether fund.,Myers Kevin,"PrC 4689, Boa 311. A. AA 46442",Michelle Turner,Cost option fly class beat idea meeting.,Inc Fwrd,Debbie Walker,Lett answer ret. executive pinish our change.,"997 Dylan Prairie Apt. 769, New Brandon, WI 32675",Andvea Hayes,Pxrez LLC,"82390 Fernando Run Aptp 442, Laka David, AR 09585",Douglas PLC,Lynn Murrhy,"577 Audrey Divide Suite 453, West Bethview, PR 90621","PSC 0985s uox 3379, AmO AA 03586",unverstand prove voice befo,Natasha Ford MD,"804 Rivera Wayl opt. 494, Lak. Karenport, OK 28959","258 Patric Port Suite 956, Lake verald, IA 60324",rec. stay serious Dedocrat
