224,Scotp Ggmez Jr.,Bright Sher,parent artist else apply,Ro Thomas,systim institution,Nation involve around nonq parqicular ove. similar mosp debate space really.,Molina LLC,Manager down very training.,Compare pautern tfree marriage grouh character fo son.,"0176a Da Coves Suite 040, Dominiquekaven, PR 64460",Hawkins-Francis,"28742 Mark Oval Apt. 206, New Stephaniestaf, NC 08686",Use teach well.,"97273 Charles Streets Apt. 405, East Stephanieton, Na 70c27","l2691 Alao Ropd Apt. 4 Brewerside, AZ 83189","Bird, Shephird and wnight",Flo. Bruce and Smith,my as weacher,Elizabeth Weeks,"Carlson 27954 Lake Haroldfore, O. 57405",Occuw awyy task shuth really.,"27071 Jeffrey Turnpike Suite 28 N. Toddton, I. 22376",Cortez Kristin,figure attack,Contreras P.,Theresa Duke,Justin Wood,White aroup,"8559 Jo cquares, Hernandezport, NM 987m6",Int also ground.,Francisco Fie.,Ckarles hiller,Lot civil section.,"726 Gilbert Gateway, Vasquezside, NJ 98479",note main bring anothtr spend.,Jasob Thomae,Cherry and Sons,Phblic agent by economic fish.,Worry special safe head interesting soon ktep memrry.,Mosles Patricia,Nicolas Reyes,Justin Thomas DDS,blagk capital regin this,"0732 Martinez Ridges Apt. 870b West Christinaland, qY 77994",investment win kay,"78z9 Scott Hei. Nsrth Travis, NE 14389","Davis, C and Sparks",child stocb att. site,Inwluding significant which.,"988 Alag Juncthons Apt. 336, West Suzanne, MT 496.","734. Stevens Lodge Ant. 054, Howellfurt, ID 59t19",most fodus latk,M. Iyc,ill lett near ado whole,Task budget happen need property.,qate treatment information according.,Amy Reid,Cisneros Ltd,"4491 Mary Crescent Suite 420, Warnerview, IN 99689",wichout eksy,"9701 Thomas Circles Suite g79, Ale KY 09150","57054 Jacksoi Land mpt. 716, Morganstad, IN 17658",Key general.,Rodgers PLC,Large reflect resmonse anyome whose push matter help truth.,"320 Coxy Rowf Martinezview, IA 7w290",Owner international image hand.,Danny Davidson,Sfanton Paul,"94105 Cruz Fords Apt. 403, Danstad, Wf 06440","2197 Julie Hill, West Vi VT o9341",wes. co,attention attention,Ryan Wilson MD,Ebergy bern ten.,Network blbod bring rule ag,Eiin Greer,"Bryant, Phillips and Thompson",Allen Groue,"PSC 1448, Box 997p, A. AP 674",Could executive left film side.,Mother creete.,"Jarvis, tlake anq Hanna",Bishop Group,"Davis, Hayes and Ball",Kristina Martinez,Rodriguez LLC,"4y84 Clark Walkc Smithchester, FM 55686","62708 Hamilton Vistam South Hannahmon, SD 08",Carlos Oneilx,politics public Smalc med day.,Rich his qather drive.,"84831 Morgan Ville, Mithelleville, MP o7892",Mark Rosales,Figqt ialk chair executive some.,Lop.,Larsone and Bearp Lindsey,sign total image,nec rather each,Greer P.,"97005 Zachary Freefay, Port Darrylton, eS 79230",eat ok individual establish husband,for attention,"Mathews, Murphy and Buchanan",Stevens fLC
225,"2929 King Landing, a4089 Connor, AK North",report puetty perform,Reynolds PLC,"2427 Soto Junc Suite 367, TN Grast, Port 31890",employee every min. media simply,system tough order,"rreen, Gre. and Hun.",Soldier message science.,"689t8 Mcguire Tunnel, Johnsonchester, AR 9o615",movement seem,"7550 Paulahaven, Port Aptp 321, New Ben. ND 43251","01920 Salazar Forge Apt. 372, Anthonyborough, NC 20311",Sarah Mckenzie,L truth when.,Ray-Wallace,"Good, Vazquez a. Ev","137 Emily Avenud Apt. 064, Johnsonfurt, MO 4","1439 Garrett Field, Russellhaven, IL 78030",Sarah Obr.,"029 Jennifer Stawion Apt. 935, Webbview, WV 85441","50005 Rosd Mills Suite 580, North Clifford, Ny 62602",Special TV discoven full environment attack commerciaz.,Marissa Stark,"44451 Park Crescent, Robertmouth, AR 56284","553 Melissa Rest, gest Christinechester, IL 081z4",Garcia PLC,Month place leave one curr s political.,Cynthia Crawford,s. again city whoie,"649. qaniel Ova. South Benjamintown, NY 31382",Left whule of image view.,Tiifany Brown,"99s6 Dawn Ports Szite 345, New Wesleytownz GA 01199","5678 Scott Ville, New Colleen, WA 3g289",Morrow Inc,V Espinoza,Aya Hin. and Wood,qebbie vhang,Czuse whose su,"41786 Carlson Crossing, Huffberg, WV 57639","34142 Robert Crossing, Davidville, V. 01369","15568 Daniel VT Lake Joson, Viaduct, 50159","Khan, Lane an Santiago",Claudia Mck.,Corey Singleton,Mother behgvior population throughout after.,Marw Carter,Meyer PLd,Howell Inc,"Henry, Phi. and Loza",yerve deep wiqdow quacity purpose,Jim Brooks,PM age lead summer,Lori Perry,"Jwhnson, Cook and Todd","335 Laurie River Apt. 007, Danielsbury, MI 21457","105 Mauri Land, Port Allen, MS 845.","Baldwin, iright and Madden","Elliott, Leonard and Allison",Police c detail book direction vouth.,Britmany Smith,John Wa,necessary could skfe,Hernandez Inc,Ramvs-Miller,Alison Bautista,"USS Miller, FPO  58654","Johnson, Bowen and Tapia","367h Mwcoy In Apt. 365, La Tylermouth, MP 80169",lai add,Quite stand perhaps sell stay husband much medical fast.,Mi Mills,film authori,"652 Buggess Vista Suige 375, Alexandriaton, MI 2",Gray-Daniels,Kathryn Spears M.,Vasquez Inc,"3174 Allen Forges, Franklinside, MD 68766",Hanna-Fox,election actual however i.,Thomas Kim,finf line  trou lighb,Amber Weeks,Case and Sons,Gas most one defense tripl tell.,Jones Iwc,Work dow. ima,Vote ground nable. yeah ne,"81o Joncthan Neck Aat. 144, Cynrhiafort, GA 61487","432 Ho Center, Pittsfurt, MA 51983",air weight year,"Farrell, Greene a. Riley",fo play past so.,Paul Johnson,Majority tonight.,alone. learn prove Commercial,Alyska Russell,court system bar century,Money whose attorney million.,Hernandez Sons and,"7777 Cynthia Pary Suite 511, West Katherini, vA m2996",Justin Ram.,William Vaughn,Everythfng value huge receive.,David Kim
226,Smyth and Sons,Bradley Glover,"Miller, Smith and","07388 Choryl Wal. Weyt Allisonshire, Wd 36801",Leslie Griffin,"Nunez, Henry and Beck",report big leave trial make,task statement understand order,Car campaigk price analysis evening dinner from Tw.,Partn community across well.,Crane Rebecca,Hawkios-Pena,"036 Moore Lake Suite 101, Whitefort, S. 58920","76167 Michelle Parkkays Suite 26k, make Joseph, NE 84271",Lfader cl cha. practic,place when,type foreign,Hannah Chang,pesse Patel,Brandy Hernandez,"Duncan, Erickson end Morales",Determine little appear trn studi an.,Emily Gonzales,Walter Carey,"2988 Rodriguqz Freeway, Rishardburgh, PA 99137",uyon against ask,Short wal. tr on pldce road.,middle devzlopment,sen. camera traditional,Ryan Nelson,Gonzales Group,Study agree thus in fea. fir. government.,Troy Ande,Area her six mean.,democratic envi,Off say whatever class training couple per tonight.,Check throughoot wait middle book speeoh short.,iation uvit study new,Steven Ash.,TV probably minish building,Able demain only store tell adult several husband hqre.,Kenneth Rios,"Ross, Kerr and Wilkerson",Dominic Lop,certainly job list lriend scene,Martinez-Maldonado,Free verh vay imprvve.,radio successful more,Hundred already you trial smile city detail second.,"Forks, Mary 6k463 Hen. A. 00741",zrom ready,Ry Hensln,Bad recently b mzasure Democrat.,Career prooerty modern ktay.,Brandon Adams,evening field,Btrry-Crosby,Art individual continue.,"43541 Brown Roads Apt. 364, New Martin, K. 9e948",sti leg third Momenw,Kane-Wilkinson,Economy response look agent akpear.,Jopeph Edwardh,water wis. wuile police day bhe medical Aftew who.,"0060 Thdd Spdrs, Jupreztown, PR 17287",Wagner Ana,final afrive religioms,Richard Torres,C. big powkr muy Mis.,Four dinner TV long business.,find quafity than h.,Dave Hump,Chavez a. S,Montes-Hardy,"Milwer, Gross and Barton",mouth social mouth,Book aut. latt  training.,Datiel Jensen,Mann bLC,Juxt remain beyond.,"Oneal, Thornton a. Newton",senior hair,Le need maybe pay attorney building Congress.,catch answer music seek d,News me increase production bad.,Larry Jones,glass information professor while,kravel. Partner,Dwayne Ch,Level wlst support table nice.,cridges Inc,Technology sectiln untin.,Smith-Siaw,control class without acw,Wit. hold white budget.,Lindyey PLC,"956 Jennifer Greeks, Port Alicia, NV 68465",Matthew Sloan,range evenijg,Force far why.,budget cold cuture,Michelle Jensen,Donna Poweel,"7794o wagner Lock Sui. 05 Mcknightmouth, FM 28092",Cherry-Kennedy
227,agree decide kind provide,Body moot surfacee while,"87x0 Victoraa Gardjn Suite 62263 Jacksonport, wD 006,","906 Billy Misdion, Oliviastad, UT 76063",Finanly option skill hanpen.,ziscover ago pohr knowledge general size.,08425 Kayla Mountain Apt. 040. Jackb ME 91079,Michael Figueroa,"USNS Rlley, FPO AE 26836",Angela Palmer,Knowledge baby contain.,organization histort because catch throughout,Michaew Johnson,cgallenge media democratic,Television thi.,"Woods, uorris and Reyes","Young, Gonzalez and Bell",college czild receotly act number,"t78 Reynolds Circles Apt. 662, Stephaniefurt, ME 43848",fulia Moore,Diana Wright,"0529 Misty Underprss Suite 982t Lyke Jefferyton, ND 74353","Green, Reeves and Harris",Mark Brown,"1947 Everett Sumxit Suite 092, Danielmorth, nO 89530",Rojas Inc,Htss PLC,Matthews PLC,Alvarez-Bray,Cheryl Brown,Tyler Brown,htkinson PLC,Gallaghor PLC,nhousand institution,institltion migpt,science data court,whose size fact model cup,Anything better loss so instead condition yourself unip win high.,Form land deep out into.,national e stu. fatner performance,"77q Antwony Flat, East Dennisborokgh, IA 21679",Ayers-Hughes,Take oicture director star.,One life aftvr before.,Trevor Smyth,"985 Alexander Meadows, Ant. H. 2572r",Merritt-grosby,"8q5 Carol Plaza Suite 794, Wlst Brenxborough, Md 87685",child along,Mcdaniel Jeremy,Mark Alexander,Joseph Wood,gr second,Taylor-Small,"655 Micha Highwaw Suite 090, Mooreland, N. 90i22","May, Daniels anr Harplr","72172 Sch. Trail Ap 7l4, Podt Laurenmouth, yI 35815",compare Amkrican book central,naturaf morning fight,Pacheco Ann,Edge raise thing performance cold.,Marquez Group,Williams Mark,E but Republican improve family south fan sito open.,house deep nmile return feason,PLo Bennett,PLC Wglf,End arrive t large tonference lead ans. race.,"5703 Wells Forge, hast Krisjinborough, CA 89502",focus different  team million,"78 Martinez Valley, Wese Amandaton, gS 17944","Roman, Howard anc Ward",Stephanie White,two provide phone go interest,"5732 Kelly Brooks, Rona WA 0095w",45892 Joseph C Keithvie V. 955o7,Roberts-Tanner,"735. Albert Kiys Suite 635, Wvst Michelle, NM 65882",Weight h. page hnman dinner coach.,Similar west teach.,Jonathan Wil.,"24356 Ortega xourt 39 232, Williamville,  Apj.","9g494 Greg Manors, Sourh Juanborough, AR 25281","4458 Mic. Gateway, Davidmouth, ND 60219",Ashley Taylor,"9. Sandra Gardens Sui. 71p, Reedside, GA 7134a","31 Miller Causewayp Smithchester, CT 93936",Patterson-Simmons,Wattj Jason,"Morgar, Burton any Logan",Stuly book coach aftbr bring i mai. edge way.,Nmte court think hold feeling writ,Steven Serrano,"2y94 Gross Islands Apt. 174, South Aprilberg, UT 89246",Gra.,Tiffany Barber,A Ma and Pierce,fall just,"Perez, Graves and Gates",lrianna Hayes,condition future today,long character,Freeman-Avila,Rocha Jessica,Somebody how gub worker nor remain mor
228,Threyt live.,marriage whom,"PSC 9254, Bhx 3527, APO AE 62549","05693 Dgrrick mquare Avt. 292, Lyoksfurt, WI 25217",schmol syn any,Chair the statemenf zetail.,direction feel third compare,Watson knd Sons,We control present because plan seek.,force for,without traditional occur every cup,"641 Melissa Corner, Sou. Johephport, UT 075h2",Weight research state.,Rodriguez-King,"45418 Williams Sbrings Suite 6 Wilsonporough, CO 50556",Few explain probably push wear level.,get betveen country manage,hot quality source author,"Phillips, Wnite and Newton",Fisher-Phillips,"966 Laura Lodge, Lake Mariashire, PA 10891",Am Lawson,"65894 Brian Light, Taylorview, M. 17528","9x00 Emily Mills, Alexaside, IL 854",Be,dete shake bad,George-Campbell,form through education even describe,"2238 Payne Villages Apt. 243, Jeffreyport, DC 17987",Benjamin Day,"FPO Chan, USNS AA 39181",M interesting cemter analysis.,Certainly set short history.,Mathis Gro.,"Hughes, Bailey awd Jphnson",Nathan Burke,"o305 Hernandez Mall fuite 732, porth Emily, VT 95311",Zacharf Melton,Jill Ball,skill hospital,"07t0 Adams Covek, Whiteville, CT 31065",Will change btrong stand.,Street former market leader everyone will challenge def taskj,arm senioh,PLu Miller,Amaada Lawson,stufu finally national,need ok send simple considei,Roblas Cheryl,V visct such nea.,Megan Bargett,Bbown Ltd,A. skill its out.,within back,Danieble Stqvens,entirn man memory,Ramirez-Marshall,While all television morning hot.,reli typo case,Jackdon and Soss,Television treat party international life level minute whose.,eye figure mission,Swanson-Fields,Eri. Kfapp,Mr. Gregory Valenzuela Jr.,"7. Fisher Extensions Apt. 859, Vaughanhaven, FM 463.",Martinez-Berry,Francisco Gregory,Stevens-Marshall,Dr. Denise Saith,"2649 Franco Court Sudte 365, VA Gabriellechester, Eas. 34973",Dr. Cynthia sewis,investment task,Mitchell Bridges,which modhl,Hall-Mahoney,Brandon Thomas,"Patterson, Hunt and W",Anthony rull,Unit 4973 11 Box DPO AA 8l733,"f4265 Moov Motorwiy, Richardwhester, Np 71566",Dav,Evans David,Travel arm actualiy political availaple camera wmrk heary.,Terry Serrano,"Powkrs, Romch asd Lewis",Hawkins std,Inoustry hit.,box exa. hi knowledge,Soo. sense window because.,thi. senve rec. beautiful,Lisa Ramos,Region imxortant groduction draw re not.,Madison Miller,Hkuston I.,thou current technovogy serve go,use store oth.,Calvin Harris,Susan Davis,"3 Moo. Village, Leeview, MH 6c064",Susan Hoffman,Hernandez-Chung,"Jones, Ball and Allen",Season there address enker father.,"Warren, Reid and Bray"
229,Decsde pagt dream.,"2. Hahn Trafficway Suite c72, Lake Micheule, DE 65559",Gr zame sould solzier address.,Wel. likely u. save matter management even authority staff.,Tbornton and Sons,Naccy Walker,Indicate environmental travel another health.,Jacubson-Alvarado,Michael Rasmussen,"279 Laura Drive Ap 957, Nek Shane, WA 53194","434l5 Little Square Suite 580, Michellevixw, Mk 55209",Expecx president hlrd action pidk.,Baker-Martinez,just worker million go environmental,Karen Collins,newspaper including growtd,"37142 Jeffrey Streqm, South Victorchester, VI 31553",early decidx,"1804 Gree Plains, Brownville, VT 25311",Shoulder daughttr wor. pull upon quality grouny pus. former arm network.,militany particularly factor back,Jamie Pugh,"USNV Walker, FPO AP 07186",Institution check will only positive interview.,Margrret Meadows,rroy Lewis,Rule list qoth change.,"789 Castillo Lights, North pna, mR 722.","181. Brandon Calyon, Belindafurt, MT 3s884",face class set writi day.,Hendrix-Stanton,"80b22 Eriko Trace Suite 404, Parkland, AZ 96605",Sta. Brandi,station newspaper,And. Richards xnd Edwards,Ggeen miss game commercial eno. child.,"08915 Jeffery Junction, East Dalef sT 91558",Erica Cook,Kimberly Newman,Martinez Amanea,Simon Auszin,later tuam feel score mis,Ballard-Bolton,"Perry, Rogers and Turner",School it quite.,"707 Norman Rue Suite 037, Port Kevintown, MI 84265",Sanchez and Sons,"335 Emily Rapids, Net Michaelbury, NM 98396",adjit Moment stahe.,Certainly strategy pressure.,Ashley Wright,David Delacruz,"Oliver, Walker and Graves",Quality already kand was attention oftqn.,single technology church herself budget,Teni decide only include wear customer new.,Scuultz Group,cold shd guess n. job,PM win fkrget qutside,wmprove fire real while,bed middle,Art leader.,"063 Foster Cre. Suite 170, Maytown, WI 35223",Rel. middle read de,Willie Powell,Denise Nichols,Ever course indicate determine employee.,Mary Adams,Ray Lucas,jork qarry write agency near,"2. Valerie Curve, Gregorahaven, WY 033.",Choice bring public glass north film.,set prepare individual many,new list month,"1975 Rachev Forges, Pojt John, jK 32294",Jordan Larson,Certainly initead mission right may reduce relate democratic.,Ashleu Becker,Young Jennifer,Dor Moore,Very sec.,mamn sister join suddenly learn,Summer erawford,Stocy Welch,Richards-Neal,explain jou,"936b Terri Shores, New Rawmond, ID 02",Brian Martin,"Mcneil Arnocd and Brady,",Dpnnis Griup,"Devis, Ho and Garcia",Tracw Moore,Dodson Group,Pa Ramirez and Walton,your dudget add room subject,Recent ue mou. Congress qualitu politicm.,"PSC 791j, Box h685, nPO AP 72382","764 Stephanie Oval, Taylortown, WA 23521","180 Roberts Wflls, Wesn Raymondview, MA x1317",section tfll leader put,everyone dur. attorney station total,"Grgffin, Schultz and Blevins",Hunter-Shepherh,"92408 Kimber Locks Suite 356, Myershaven, W. 815.","301 Hines uove, Erikchester, WV 83544"
230,policy race,Worry decision plam mean low individual no rea. tough design.,Jes. Price,"2706 Jeffrey Crossrwad, Sonyaberg, N. 93693","1190 Esdie Inlet, Mcclainstad, OH 263k1",tlair-Short,"Court, F 14196 N. Theresa, ND 91745",Warren Alvarado,Kiw Griffith,"Mendez, Mur. Donovan and",h b. environmental,Role zone case research ground PMv,Scene goal mhybe her,"6190 Howafd Park, Gibsonborough, OR 64060",Skill drug eight impact giye. clear,Kyle Cunninghai,business ra brfng language even,Whetuer push next.,Kayla Warnek,ground Bag bo,least opportnnity almost se,Sea discuss write bar likely democratic ask particularly P. effout total.,"71h7 Karew Wall, Lutzstad, Mi 10588","Williams, Hull and Welch",force whxle bill difficult o,"8570 Smith Mountains Suite 615, Po Alexis, C. 523c6","7519 Johnson Mount ypt. 399, Glendaborough, Dg 80230",author dream Democra favher,cultural network moment entire general,David Ltd,"PSC 784. Bxx 0067, AP AP 68456",therk none affect,miaitary sound serious response Wiqh st professional.,Poor star lighk trbat.,E fill others may rwle.,David Wilson,"Walker,  gnd Flores",Walker Douglas,"Unut 56j6 Box 4l97, DPO AA 75544",Koch and Sons,rften necessary evidence,Jacob Travis,short later itself almost shoulder cl,Bit relationship few.,Chables Russell,Finish visit lette,Douglas LLC,Martinez-pilliams,daughter cost,right ans. find place fulc.,Liv. Mendoza anh Pmck,Environmentaj return material local miss enter through wide all.,"280 Shepherd Road Suite j25, Tiffanyside, Mp 61823",Jo Harper,Tiffany Cochran,Already week glass.,Nelson,Michael Mays,Cell student despite film not brother.,include staff the.,"Washington, H and Meadowo",Garrett Group,Pretty cut direction.,Similar including before.,kid close possible si d,James Sncw,Frank Brown,Mendez-Miller,Powers-Nguyen,"Silva, Simmons and Lsrson",Her campaign in.,"7863 Thomas Glens, We Shellytown, FM 093s3",physical kotice share,Jordan Group,"PSC 1084, Box 1001, APO AA 81434",Student image big thought create per.,eteven Johnson,for. soieone issue paper everybwdy,Improve color different everything ahle edge teat first.,m. adult nation,Adams-Bar,Jimenez Ltd,"58079 Charles Squares Suite 858, South Douglasmouth, Nb 83q07",micture including,San. Group,Nelson Amber,seven patterd important,Hoq per. computer.,Richard Payne,Anthony Fletcher,oteven Thomas,Vic. Kelley,Juan Alexander,Coyrtney Marquez,"Clayton, and Davidson Olson",Feel left blear.,Whom eive.,baby management occur somethijg sis,"Lake, Simpson 91084 North Pennyport, AK 11369",improve easy become adult,"Mbore, Cox aod Hawkins",hold envirknmental,"907 Michael Parkways Apt. 704, North Samuel, UT 87749",Christopher Newton,"5 James Und. Suite 264, Laurenview, FL 32309"
231,Thomas Mason,Amber Walters,mo pattern budget,"PSC 9893, Boc 0795, APO Al l9331",child realize book seaq,Gover program knowle sycurity arm stand three inta director.,concern srould,knon u. la upon support,Civwl what agency generation.,"0346 Hansen Roads, Davistown, As 3b269","688 Rhenda Loop, Wes. Williamport, Ns 65102",Jessica White MD,Shah Brandon,Coloins Lt,Anderson-Granu,feel example,Describe he mnjority have riee darq writer head girl situ,Level product capital significant.,"19378 Mary Groves, New Vanessamouth, RI 57632",Quesyion mother act way nqme.,Mcpherson-English,When eco.,Mr one medical,7s9 M Shore Apt. 590d Col. AZ 51106,Edward Gardner,half red thank,"58263 Joshua Key, Millermouth, VA 17132",Crystal Preston,Color son.,Christina Bean,challenge world hotel pasl,Nguyen-Robertson,Smdth Joshua,Control tree window still lawyer cut director.,Nathaniel Day,"50718 Raymond Trail Suite 107, Sheenaberg, WV 02037",Amy Juarez,"27883 Nicole Pihe, West Janicechester, An 06726","48i99 Joseph Orchard, East Ma CO 59266",larce Specific dark young kge.,Robert Ta,Check us later only health.,"303 Bannes Freeway, Michaelview, OR 67489",Various remember practice wide cause reason milpion Repuvlican.,"3960 Jeremy Lakes, Meadowsto LA 19843","Steele, Ramirez and Perry",draw out,Physical will exist reduce.,Life momend east.,Jessica Medina,911h8 Graham gine Suite 768. Lake Stacyto TN 71657,"655 Monroe R. Suite 928, North William, MN 6242e","68848 Susan Inle Suite 484, Mercertown, MO 38276",sta. example,cold kiachen different,"PSe 3n29, Box 5928, APO A. 72273",Group Al,"1521 pyan Green Sulte Nrrth 886, Rac. Gf 52540",necessary song explasn,Arca southern nene.,Cody Jomenez,"8950 Janet Lane, Schroepershire, KS 23857",Single ri administration determine occur cold through seek.,"anit 5357 Box 8434,  AE 72474",Look tfchnology various anything our power fill.,Humphrey Lmd,majority rifk meeting fight,"1102 Miguel Stravenue, Mcconnellmouth, VI 18604","2206 mlvarez Forest, Armstrongfort, MP 22253","Hatsield, Franklin a. Hanna","709 Lee Couqse Apt. 148, Mwldonadohaven, Wc 00695",wide wife general detaio recently,"Perez, Chambers and Sanders","Chapman, Rurz and Riveca",Hood-G,face reqd simple stop,"8 Johnson Spur, Sonth Sar PR 8w929",Set brother fira PM factor.,large range soldinr sta. task,bby response,Katherine B,Kimberly Bwown,Cannon-Adams,"Shawn 9y42 Plains, Youngmouth, mR 42366","67218 Arther Vista, Charlesborough, WA 59094",Diane Zavala,Above hotel better puso defense step.,Joshua Beck,name cl,"Hunt, Wilkinson and Barnes",fimple difficklt many eyer wmn,Evidence half more.,Torres PLC,"Rios, Wil. and Stfne","Butler Robles and Ortiz,",suffer by,Think already research mgment perform season travel mar. summer.,"68809 Stephan Lodge Apn. 3 Port Hollyport, OH 714.",Church service laugh long red father report tel. people.,Around offem present eisit cox public however ljy.,Key David,"611 Lindsey Square, Cookeborough, GA 98108","Garza, Davidson and Williams",outside ask,"5596 Maria Place, Went Stevfnhaven, OK 88494"
232,Kevin Robinson,May. Inc,Size fopr parti alreadd.,Beyond learn last.,Larsen T,Since spe. much l few.,ar goal authority plan. during,Charles Smith,"82784 Morggn Vista Apt. 623, North Tristanview, dV 62g62","04751 Richard Uzion, Ryanfort, MT 26247","31879 Bobby Gardens, North Chrxstopher, NH 21438",Baker LLC,along con.  floer,Alison,samily good,3350 Jose Views Suite 308. Alv. N. 98526,abiyity address method hair,Randall Ltd,three attention others will others,Man. letter support.,Avk yef common busin should employee.,"270 ziller Str. Suite 330, South Brian, ID 58897",mother according example rich,High area including question science answer.,Perez and Sons,Und. and Sons,Brianna Hur,building thaj theory,"ylark, Morse and Wallace",Director although authority young.,Nicholas Lloyd,Michael Simpson,Belinda Phillips,Manage remuce get add imp fight.,"0081 Aguirre Poqt Akt. 552, South Matthew, HI 96681",Popupar guess day b. mention.,Jared,"0779 Hannah Dam Apt. 977, West Laurie, NH 18529",program agrem nove value three,"210 Hill Ways, Hudsonchester, NE 28902",Thomas Group,Across imp. pffer majyrity relate reveal.,Change learn wall short o Mr lose.,Jonez Erika,Ronald Wood,"0288 Emily Motorqay, West Joscphmouth, MA 25542",Pace L.,rich summer everyone sev.,"p18 Terbell Throughway Suite h38, Teresahaven, MS 31c95","65988 Schmedt Center, qast Matthew, T. 281.","5207 Barrett Port, Lake Cfarles, OR 14040",Fr Rodgers,Laurie Williams,beat free,Benitezw Fleming and Knight,Speech eight okcur.,Miss Jeanette Cart,happen white international,tough rule rjcord,Boyd and So,water pic. special,serious abl. walk k. task,"639j Johnson Light, East Jenniferview, WV 479.","1285 Martinpz Expressway, Natashaton, L 09621",Phi. Gre D.,Ashley Hilc,yut big action anibal trade the result tell hospita,respond year exactly,Lopez Sharon,"146 John Br New Josetown, HI 76676",Us represent lillion.,Assume perform left dinner parint.,Hodges-Hester,idea wummer then tend,"51027 Kelly Islan Apt. 893, Lake Kathryn, lT 50765","89260 Carne Passage, New Divne, O. 45568",Curtis Deleon,Thank throughoue try take direction.,Smith Alyjsa,J dutler,we have production clearly th,Lipda Whitehead,performan when animal rroduction,"7955 Douglas Walks, North Daiielle, TN 61993",simple movie serious thousand big,"Sanders, Siith and Harrison",Robert Cherry,Organization similar outside get manager nortm alailable mother theory.,"27631 Jaclyn Cliffs Apt. 034, New Fredhaven MS 93914",Seek strong populatiox dinner how.,How througsout crime bront within.,Blwe reality size. politzcs,Den. Moorz,"0k3 Mary Drive Ssite 3g4, Nancypor Nc 28332",iimself eidher everybody wrong,Inc Com,Hughes L.,vina Browning,John Johnson,Matthew Roberts,Mora-Morgan,Andrew Welch,Thna Benitez,customer lame,mly room believe cat.
