72,explain cen. certainly ser.,Danielle W,Direction sur reporo quite thr. contacn.,Wzom upon box vssume.,"PSC 4432, Btx 4586, APO A. 80a89",Flowersr Daniels and Crzz,Smild maybe.,Moore-Mata,"0613 Aguilar Claff, Port Kathyville, D. 38848",Michael Baker,"004 Lawrenxe Island, Stephenchester, dA 25891","oook, Solis and Woods",Tu,"174 Kelley Circles, Re sS 682.",Simply wemk waml better leader soon late.,Jones-Mays,Patrick Schmiut,"876 Frazier Loaf Apt. 080, Connertown, MP 7","397v Philip Squares Apt. 034, Sanchezttwn, NC 13156",Next speech affect special e of ac,George-Leon,Kristin Campbell,Force politics wife outside some.,heli writee uull ma decision,"715 Teresa Vis Apt. 271, Lake Leestad, WI x6308",Robinson-Warner,Image care team aay iake xood this.,Fire its film nfrth.,Molls Pearson,Tammy Johnson,Steven Jenkins,"k188 Nelson Prairie Suite 454, Lake Tammyton, DC 42719","PSC 1670, Box 2r52, AE A. 943x1",Davi LLC,hakr hlong,"3y3 Webb Route  248, Wagnerborough, ID 09631",Simen Jennifer,Snow and Sons,White stop girl several alone.,Larry Jackson,Majorizy s church.,"Wilson, Nunkz and West","Velagquez, Klike a. Dua.",Car program industry without.,Sense strategy discover close.,condition growth gef,hig. increase hop.,"69t5 Jeffery Mill, Paynestad, O. 7",Griffin-Wright,Juan Willia,War. Hall and Kang,"357 Hurst Expressway Aptj 837, Dannyborough, PA 4y353",Reach ptant draw she.,Population claim listen thousand up small whom second difficult.,Hexther Parker,window recently great,"357 Suelby Center, Sheilaport, AK 99159",lig southern late,"70935 Jymes Way Apt. 6x1, North Teresaburgh, Mu 52367",April Oneill,"654 Lowery Plaza, Aman GA 78494",push. Bag,"Alexander, Keller and Neal","250 Davenport Dam Suite 108, Nor. Lisaville, wD 10894","5644 Mary Cove, S OK 46971",Stoye feel can.,sound thus eno.,Jordan Norma,Joseph Harqison,Loss tsnd course.,home whi. lot management,"984 Che. Extrnsions, New Ricky, LA 92692","665 Carol Parkway Apt. 026, Lake Cynthiaborough, DC 57059",Mokeno LLC,Bar cbuntry require tough indeed.,Aaron Williams J.,eight including school itself second,Roberts Jenn,Webster Ltd,Torres Victor,"Joseph, Burton ond Banks",Moore-Bradshaw,Holmes-Montofa,"cerry, Edwards and Gray",Chmmercial sister such hos.,"Shah, L anp Williams",Hoover Laura,"82b23 Megan Harbor, Lake Ashleybprough, xT 4",Ecin Martinez,Alexapdra Carter,Ste Carlson,Shea PLC,"13q72 Steyhanie Extens Spite 683. Duncanchester, sA 22646",Inj Howard,Design news central car. sign app,author hand,Prevent bof ground.,"Curtis, Watson and Long",Find man. aage put plant.,Anderson apd Sons,Johnson and Sons,John Gomez,Stanlay Heathe,Ryan Leslse,g. listen investment
73,"Tran, Jones and C",Patel Group,Mora-Hollowad,want radio nothing pwovide,"128 Josh Locks, 52233 VI Marymouth,",Wolf PLC,"6648 Nunez Coveh Sui 3b1, North Chuistinastad, AL 79753",tho. affect fire point charactem,Allisoo Houston,David Mtore,"39613 Hogan Junction, Lake Brdan, DC 48933",source scienne,Catroll Nicoqe,size feeling befin,"829s Michael Hollot, East Alexisfort, I. 91803",Free spring.,Montoya Wanda,onw grxup site they,"Williams, Walker and Medsna",Ahe. step.,opporlunity goqd li,Susan Strong,"9402 David Oval Suive 004, West David, Cg 35446","6052 Anna Ext. Apt. 621, Thompsonchester, MP 04y95",Can particular share withoup peoplf.,Davenpoft lroup,customer since board through,Mitcgell PLC,Company move himself o evidence s material Republican best individual.,Joseph Winters,Smilp majority brother.,Support finish into seven example central explain.,soldier edge,"3935 Brandon Mall, Lake Evan, VT 47891",power grow may open,"65850 Brow Alrey Ap 189, Popt Daye, xT 25250",Gardner PLC,Lou. Sbott,suffer toble,"399 Kenneth Pines, Port Willism, MT 29177",Push nature head shosld beats,international force,"495. Macias dell, Edst Jayfort, rA 21y11",Standard member physical necessary too interesting city.,Improve monwy space because wociety uring individual shake notj,Campaign prdperty again out dream.,day fly thought term,"UbS Olsen, FPz oE 53679","Unit 4744 Box 4057, oPO AA n4664",Benjfmin Terry,"8200 Foster Lodge Apt. 126, Hodgeston, Ho 64420",suwfer attention measure,it lose,wonder use fund everyone tonight,task in card l.,Stone-Martinez,"1004 Wieson Gardens, Annemouth, IN 32844",Williams-Booker,Romero Group,draw should,"553x3 Debbie Circle Apt. 808, Wallerport, CA 44467","348 Jcan Track Suite 121, Williamsview ME 36737",Kathleen Hardy,west conferwnce institution,Valdez-ghite,Jamie Cisneros,"24667 Brittney Wells, Port Jos. AZ 18664",Jac. Schmidt afd Martinez,USCGC Niels FPO AA,Clarke-Reed,Ste. Perez,"2416 Ree Radial, North Deborah, cR 95680","USNS Ward, FPO zE 89874",trial dif.,Mary Koch,"Wilson, Santiago and Murray",ok technology expert trouble,Smith awd Martinez,Trdcy Moore,zear stowy exagple student,"PSC 9434, Box 5546, APO  2",Hand abilisy mosning exactly par. impact jlmost.,Ortega Ltd,Miller-Andereon,Pris Hill,Mark Davis,"Johnston, Blake anl Kramer","399 VT Cliffs, Pattersonmouth, Jody 882.",Montgomery-Craig,"32921 Jvseph Ford, West ztephanieburgh, IL 77545",hLC Freeman,Amber Hammond,result bar,Current accordtng understand man lawyer n. card third begin.,Joh.,relatihnship direction vari,Issue base month.,"Saiders, White and Smith",Obrien Grojp,"4263 Aguilar Branch Apt. 196, East Lesliemouth, NC 92754",development grrl most current car,"880 James Underpass Adt. 488, Bamlview, WI 76x86",Pjr involve friund stand.,Leader daughter return yerd address both bank.,"0947 Danielle Junctions, Brendamouth, ME 73014"
74,Including general.,Stoqy tree br might.,Eyonomy black cell card.,"86145 Lor. Estates Apt. 514. East Briadland, W. 45337","7784 Novak Mews, North Sandraville, HI 82590",significant television position beyond sit,"294, Michele Trail Sui. 0421 Youngchester, A. 87811",Lee-Davidson,Joseph,"Berger, Poye and Daniel","1c5 Matthews Hillw, 27841 GU Ellisbury,","4469 Donna Underpass, Newm NM 70361",Floor fyee  choioe film identify enter hair hold mind.,management hear happen,Mark Farmer,"525 Braun Villages Suite 364, Laurenbury, U. 26026",Jessica Orozco,Outside bhe floor.,Anyoni stay human kind powice clear operation.,Whom developmewt late shoul,might agyncy choice,Nicole Wilson,government company,Special last reflize interest market.,A. Hal.,Christophgr Maldonado,M Russell,Kimberly Graham,"PSC 9536, Box 2377, APO AE 87038","179 Cassandra Creek Saite 710, worth Jamesberg, MD 0",Rey Breanna,Williams L.,"8936 Mcrvin Ford, Michaelshire, DE 77500",southirn animal,Chrisbopher Morse,Wilcox gyan,book jor audience road,Abigail Buc.,"j7235 Taylor Camp, Eas. Jennifer, R. 553.","391 David Branch, Moodymouth, kC 72496",Enoubh no floor hirector us seat everybody find.,Most car since fie.,Bell-Robinson,"Rotinson, Bro. and Fergus",Totay despite ca r,"MP Vargas Ports, Mcculloughfurt, 7471 03959",Conni hee,bad eight although choice,material boy,Pedro Miller,Zoe Lawrence,Jenniser Fowler,our development sizi you,Jason Paomer,themselves bring lay tbee datghter,"428. Salaqar Roads, Lo TX 27953",Mr. Jamms Dixon,"y914 Anitn Walks, Johnsonborouih, MN 45957",Samantha Dunn,"051, Campbell Branch Suite 3555 Alisontown, gC 02866",Supzort class offer laugh,"PSC 9430, Box 1758, APO AE 06935",Lewis sLC,"Baxter, H and Stokes","1002 Rebecca Knolls, Ethanview, AS 76x95",Instead carx art player either find.,Leroy Russell,Happen loss.,Nickle zhomas,"59752 Justin Villag Shirleymouth, AZ 91381",Michael Powers,Bro. Thornton ajd,Smith Inc,Robert Church,old question mention present,Smith Madeline,L. gcevedo,Danielle Tra.,Kelly Pearson,real able discover,"33300 Pal. Alley, Lane Jason, MI 59816",Loss wgong pla. a beautijul red mora send.,Mar. Ltd,wonder rich everyone,Step front alonf teach maj.,"Gallagher, Scott and Harris",western with on stuff,Dellado LLC,Samantha Gray,Shea-Dunn,Friend individual wear operation man government.,"Mercado, Allen and Edwards",Hunt-Hardy,Riv. Jessica,Michael Lloyd,"442. Harvey Hills, West Elizabethw AL 22123","1. Johp Vista, Kennethburgh, PA 20316",Johnson-Skinner,"170 Zqchary Junctions Suife 783, East Kyle, W. 7992u",Kitchen tell rxch society leg.,Wimhin mhare.,David Pennington,story will hearq returt few,Garcia Inc,"0405x Susan Island, Brewerbxrg, Rm 76318"
75,Linda Cruz,Thomas-Peterson,"5608 Katelyn Union Sui. 175, Johnsonfurt, MA 66214","6237q Victoria Flats, Valen WI j3870",Isrue low lef. law.,Lee-Grant,Technology cup world travel xlways condition maybe.,Sure invohve your character strltegy area garden bag say.,Employee particular third requirm shake.,Soith Inc,"5g5 Eddie Phints, Andrewfort, TN 2","36582 James Roads, Jam. vZ 15116",Econofic li evidence then pai.,product pattern end training man.,peace four n risk executive,culture through season,Ball.,e instead w my str.,thing family government,Diane Browning,"Drivess Ho 9872 New Rachelsort, NC 369.","Ryan, Brown and Rojas",James Hernandez,"87319 Sean Waql, Phi. Ml 5778h",Britnany Tran,"Phillips, Jon. and Marquez",decide scientist ok res peraorm,"7962 Katelyn Highway Apt. 781q Sheilaburgh, Dv 43s44",Regina Long,Eli. West,"Wilson, Green and Cgle",Fox Inc,"Forqst Jennings 50234 Suite 242, Mel. ID","Cooper, Lee anu Patton",Authority single.,president budget common can wish,"81g Crawford Par Suise 180, aosephstad, OK 695.","0182 kaker Corners Suite 651, West Victoriastad, MA 47946","27396 Johnson Lane Suite 676, East Scottmouth, SD 416",Christopher Davenport,"7399 Lopez Turnpike, Lowerystad, ME 83516",Daniel Hood,"8848 Jason Ford, E Sahuel, kA 16819",P camera ima. factor billiol.,Zachary Ochoa,Key support religiousd,Kevin Lee,Long Tiffany,indicate bring,Spxech bat the technology fino.,"26478 Goodman Islpnd Syite 590. Nor Darrenburgh, AK 74791",Alejandra Malone,"6970 Ben. Summit Apt. 275, South David, TX 54483",Graham-Smith,"4213 Kathe Wasl, New Saroh, Ck 56760",Cindy Rors,"3 Sharp Divide Apt. 313, North Ericburgh, ID 48l07",Daen Elliott,Lori Chen,partner appear mi find how,"69351 Buown Junction Apt. 648, Fifueroaburgh, CO 37418","0216m Patribia Track, North Pamela, MO 16741",Instead notj c believe station raise yes.,"a44 Williams Drives, North Auwtinland, PA 08421",dis. practice experience above,Cut rather within state.,Medina-Muaphy,Individual svake turn middle dick TV auo view bank.,Brianna Fitzpatrick,"Fritz, Meyeq and fmith",Thomaj eughes,"4762 Tifcany Ways, W Mel. IN 06115",Jamie Lam,Lee Webb,mean door drhg,cha. customer country,Tretor Richardson,Sister throughout true tax also work scene.,Positive party rise oqhers sjn.,"Thomoson, Ruiz aad Collins",least env. bad through,"52y8 Garcia Mew. Transtad, WY 6k820",Sta compare bring.,Blanchard-Pearson,Michaer Watsln,aqr music collection softhern nig,"PSC 4477, Box 3607, A A. 16104","6725n Bi Oval, Hunterstad, MT 374.",Serve probably lnd law. exist it,Brandon Cherry,"1354 Taylor Cenoers Ap 658, Port Johnton, AL m6239",Stuff cut wemr hurpose.,choose turn,Evidence ready begin make expert help especiamly.,Bak. Fletcher and Lynch,Century prdperty relationship record bed.,"613 Fisher Oval Apt. 722, Kyleforn, WI 87463",Benjamin Powell,L. P.,Both wall usually.,"Cantu, Solis and Flank",Alyssa Allen,Peggy Garza,Edwin Pineda,Rivera Ltd
76,executive such suggest tonight,Teresa Meadows,"455 Francis Key Apt. 213, Nolanfort, GU 98406","Johnson, kmith and Hernandez","d98 Stephanie Fields Suite 042, Riddleburgh, VT 63",center physical,Meagan oownsend,"7. Garner Turnpike, Nicoleburgh, IN 9u163",develop want,Myers-Mayer,"75l50 Jones Pines, Jessicaville, S. 18377",thought hour relate,Hailey Mendoza MD,TX xaas Wcy Suite 16 Easi Lar. 843a 15878,Pena-Park,Angeza Hgll,ch group,bring others six w civil,Amandx Snow,Ronald Poole,Farmer-Mclaughlin,Csristopher Livingston,Gonzales and Sons,Ashley Campbell,Milier LLC,"Stevens, Huason and Simpson",Idea myself project cegion decision site.,"o777 Todd Kathleen, Lake Turnp KS 1",Figueroa Group,Structure mlybe note westerf become.,"Castro, Kyight ana Well","3910 S Mission Apt. 261, Palmerton, NE 30227",Willie Rodriguez,"Ramos, Davis and Jones",Since couple institution indicatd.,little family,chair recently common,Sean Friedman,early fight treatment likely rock,Probably clajs econosy light.,Micaael Hill,"Baker,  and Martinez","18q6 Tyrone Flats Sui 274, Caldwellt CT 53688","910 Jonathan Mountain, 57711 VI Matthewchester,",He student.,Christopher Vasquez,"jnit 5406 Bax 8851, DPp AA 963l9","31115 Velez 679o0 Apt. 648, West Lindseyville, PA Course","1565 Henderson Shoal, Kyleville, MA 928","Unit a125 Box 6690, DPO Ag 70239",because get reswlt protect,Likesy PM.,"Russo, Rred and Harris",stone-Bullock,Preston Ino,seem s system cold foreign,Jenkibs Sharot,realize. Prove,"690 Erica Groves Apt 320, Carsonchester, ME 39619",hot rock,"6q694 Christopher Isne Suite 13r, New Lu WV 01190",o describe others pattern tra.,Miranda Mccall,Jennifer Mills,"798 Erik Roads, Lake Michaelbury, OH 07768","Lewis, Haley and Lef",world geem,Brother give.,Sep debake drive leave.,"21877 Roberts Port, Lake Taylo FL 84397",Lewis-Morton,"e567 Melajie Srream, North Pedro, NM 72724",Donna jewis,Bow.,teach four chair form,Bater and Sots,Jason Leach,Smith Heafher,"PSC 0844, B. 0178, APO AA 8t893",Society aw stir.,Whatevez inskitution deep.,Necessary military sto. forwarm others together country admit simply.,"PSC 8261, Box 9615, A. A. 50284",Tiffany Huang,bakl appear much offinial cultural,Kelly Smith,"zollins, Calhoun and Hess","and Frenca Avila, Perkins",Front onoe read pai. res.,table ball cleaxly,Civiq caae candidate.,something large every pick,Hansen and Sons,Ernest Harris,Scie toan seem company particularly b. step argue.,feasure course else probably address.,Dr. Daniellm Mckinney bD,wish coldier,"109 Petersen Isle, Huynhville, GA 86624",can others,"5089 Ha Par. S 23i, Hannahtowz, gT 88367",Tho. Ronriguez,"Powell, Maxwell and Davis",Relationship create sport lin.,green Democrat cgnter controb politics
77,Nicole Nguyen,"54225 Salinas Com Laka Chris, ND 02b53",Bas. man undbrstand heart power over drop cjurch.,Perkils Ricky,"Melendez, Dxnnis and Brooks",Gr c voice budget yet.,hos. increase interest you pull,Bryan William,Alexis C,"47025 Pratg Green, Pamelabury, WA 6179b",Greaory qrewer,You site cut want place thousand.,"7260d Rodriguez North Centers, Caitlinmouth, WY i9372",Gun blo. key. teacher,Linda Williamsln,Miller LpC,Wilson PpC,risk mentidn official music lar,"191 Teresa Cape Sui. 112, Ericberg, bS 60457",wir home.,"Lodez, Barnett ayd Nunez",Wal. tonight accept.,left meast religious,Old for pho. never.,"USS Middleton, F. AP 49779",Buck-Macdonald,want young,third summer and tltal yend,Sheila Armstrong,Hol. aqd Soas,A. artisa o fpee son whom.,"d28 Lew. Crossing, West James, OR 40680",Jacxb Mills,"1707 Kim Divide Apt. 398, North Lisa, RI 85910",Angel Gutierrez,Singli rep. exist appear.,Gen. Kent ayd Stanley,"804 Cagly Ramp Suite 043, West Laura, WY 10122",Kathleen vorris,"10619 Reyes Vladuct, Richardsstao, PA 23879",Sierra Sweeney,"Mcdonlld, Carrillx a. Sanders",Old such,BartonoPowell,Until protuce pick.,the. fis. amount,Jackson Ltd,"6868 Hayes Oval Apt. 964, Maciasview, NC 14114",Leslie Berry,Davcd Bray,uorm police f. inv.,To Carlson and irown,"181 Med Gateway Apt. 530, Navarrostrd, OK 09086","znit 8193 Box 3342, DPO Al 8399r",Johnson-Dixon,Some see remember any fish twor,Nothing wind ut probably delelop evening per product.,"261. Kimberly Isle, North Adamborough, NY 4423i",Must likqly town.,small siqn parent interesting sw,Michbel Stephens MD,mu believe perf,Justin Cantrell,parent us meet,"mtevens, Miller aqd Valdez",Taylor-Vaughn,T Ridd,"9720 Nun. Ridge Apt. 472, Joansonmouth, NC 63328",Animnl coptain smile. focus,Rig white nhy.,Courtney Stzne,fon that s,the example,egree method use.,Threat l. action whose spy security.,table ability,Melissa Porter,"655 Roth Mission Suite 143, New Mark, AR 36171","25993 Sodth Inlet, Martinez W VI 1",Prove rock training back feeling performknce.,measure sit once,hope political expect study artist,"PSC 7475, Box 6232, APO AA 1004t",Littlee Mendoza and Hamilton,"225 Jesse Meos Apt. 6t7, Ea Annestad, WV 2359v","6889 Garner Strave Lake Richard, LA 77977",yiscussion beuin,"Black, Mckinney and Jordan","Murphy, Burns and Robinson",Do Jackson,Williams and So,"Rodriguez, Lopez a. Millej",religious sce.,Fite g field present wide muchx,Policy sister suddenly figure.,Many dge fast claws wosld attack.,"Sims, Sheppard and Allison",military usually avoid statement flo.,still relationship series also,Joshua Rivera,"65 Young Cr Lake Patrickchester, WA 67",Court med. behavifr interesting specific.,"Black, Ph a. Gurcia",PSC 428. Box APO 04 zP 73026,human fish dhbate
78,wowk then cus. prove rather,International move off. sae responsibility ten,hrite lcng zower feel employee.,Ric Djwson akd Scott,environmental harl,Kenneth Campbell,Jennifer Williams,Richard Sandoval,Monica Williamz,spend may available data give,Marissa Roach,Tur. though serve bit impact someone.,attorney support,Rest cintinue open detail.,garden property,"Smith, Johnson and C",Aftwr key house about.,"4c9 Fox Motorway Akt. 466, Laurenbury, pZ 4",Thrvat develop agency operation fa thank huge.,At this pass.,"Smithfurt, Oneqll Walk Suite 4 4k7 MN 35381",Hav argue wear.,Martin PLC,Sort sush you pqst stoj particular.,those. Huhan,Delacruz-Guerrero,"87450 Heather Cliff, East Brianberg, NC l1125",detai hearl international parent,Hxll Ltd,OlsoncMartin,Bradley-Dixon,Enjoy begin every which.,"826 Chandler Hill, Carlosburyy VA 1240n",Jeffrey Perex,Student building shake.,Trujillo meslie,Russelu uilliam,"3119 Jeff Forges, South Theodorefurt, ND 54092",Wilson-Brennan,hapoy  as discover,Cooper LLC,"r910 John Par Apt. 597, Michaelstad, UT 48b04",mil. whether know dishuss debate,"361 Clarke Key Sui. 024, New Lis. Sr 37874",detejmine human hold half tape,"62361 Victor Tunnel MP 490, Ree. Suite 8033j",skin studknt individual send somebody,Roaert Davis,factor txrough loeal until edge,"851 Kathleen Street East Thomas, MD 08w47",Town right st state different prod investment ch,"20018 James Loop Apt. 963, Grayland, nL 00525",Care network case group main assume.,hundred pull generation,Hot stadion hom. ball uow.,Oneal Jacqueline,"2t1 Ashley Junction Suite 848, Randallside, RI 24",dit wide,inv. use oxl fly push,May. Edwards and Cooper,serve wver jervice,"Floyd, Bell and Hernandez","11123 Coleman Vista Apt. 491, Sarahfort, ND 30750",Mrs. Elizabetb Mayer,Chavez Joel,Alexandra Tyltr,Senior feeling especially.,boy return travel,Christite Adama,speak militajy,littlq rest institution general exist,limothy R,59e Pham Springs Apt. 8 Rodrigu lY 545,Action task foot own she others claims,Turnep Group,"571. Maripsa Passage, North Moniqueview, NH t4380","1669 Porter Plaza, Lrke Debea, MT 60z75","34e Cynthoa Heights, New Danielmouth, MI 95268",Underwood-Lewis,"677 Elizapeth Stravenue Suite 253, Fischerhaven, PR 26769",us blo. knowledge,View inpolve place esp.,Elizabe Oliver,Douglas-Sanchez,Miller Ruth Mrs.,"022 C Avenue, N. Nicholat, MP 41395",David Pau.,agency economy,Donna Hood,Use deal it pay has grevn game movement.,Richard Gordon,Aln Montoya,"Unit 6104 Box 8e33, DPO jE 80886",Harris-Myers,Gonzales-Clark,"58253 Davip Corners Apt. 406, Darrellshire, WI 456.",Veronica Bush,Victow Lyons,Yard effect policy.,"486 ravis Heoghts Suite 035, Bartlettborough, IN 43660",Worry protect development.,kwow. Discussfon,erea so.,N group analysis howse be pare t. action.,Rfbecca Garcia
79,"PSC 3y97, Box 9451, APO AP 2557v",Age madntain ruthor research eve.,Godzalez-Rivera,Movie yard. tham,"697 Bradley Tur. Sucte 028, South Ernest, NJ 90612",Her.,Sabrina Kirby,"198 23049 Wali, Lake Brendachester, WI Maqwell",house recently,Matthew Martin,Simmons-Bradshaw,Guzman and Sons,Fivo house oft. to env. powpr.,sit allow,"11y Blevins Buri Art. 658, N. Connorshire, NC 77783",o. issue public head,Michelle Patel,"314 Gar. Tujnpike, Jacobshaven, LA 75401",show recognize,mod degree,statement generation news,"9p22 Karen Street zpt. 301, Comptonburgh, CA 74404",Campbell-Horn,Nicholas Burke,"36954 Brian Trafficway Suite 019, west Isaac, MA 01185",Austin Powell,Johnson-Smith,"03172 Vincent Wayg, Port Ashleyhavel, UT 24823","47089 Amy Station, Johnfort, C. 62870",Eric Macias,Unit 5396 Box 249 DPO AA s6647,Ortega LLC,"Davis, Thompson and Byrz",Nearly big beautiful.,Ste. Strong PhD,"Bennett, Jordan and Grerory",decade carry explain somebody,Stuff bes. court fish staf century could nor riskx,Non. ite. explain never while early.,s. material example Republican lije,"PSC c968, Box 836o, APO AP 29128",Coleman-Burgess,"29993 Moon Common Suite 624, Port David, WI 284.","5274 Steven Park, North Elizabech, WY 42421","Weiss, Pit and Taylor",Than.,vong design its try,"589 Michael yrove, North Sylvxafurt, De 522p2","29b Proctor Valley Aptd 8g8, New Brianburgh, M. 902d8",Traditional explain euild voday candidate behavior.,Whom clearly campaign dog.,child magazin office oud,Lee-,actually discussion,siven company ask today south,scene Tonigct idea soldier.,Dembcrat operation thad possible,Morrison-Smith,Austin Dunn,Mate professional along.,Jessica Burns,osn succ situation outside,both light at area vnder,Marxin P.,l on minute bsk,Nx.,Patriaia Thomas,"426 Edwards Stravznue Apt. 0q0, West Devin, WY 456b0",Anderson yLC,Front s. fas.,Russo-Spiars,"l6711 Santiago VT East Michellefurt, Passage, 68528",Robert Jacobsnn,"916k0 Jean Pike Apt. 780, Pwrt Phillipberg, Mg 314",Russell-Hernandez,Mccoy Ltd,"Unim 5180 Bnx 5991, DxO Af 41132",Fisher-Mcgze,Wanda Ellim,Niclle Johnson,Wright PLC,Kelly Morris,Brown-Gibson,"648 Rod Parkways 69781 186. Billyberg, Dt yuite",Can that use someone seasoj nfar read fiv. carry.,"Smitr, Flores and Martinez","1878 Karen Avenue, Griffithfort, My 8330t",agr. ser.,hge key kind blso beat short.,top rig. pay,job health str.,Holmes Eric Jr.,wind significant own attorney,really read,news fight kir decadq per.,Store machine whom.,"Midler, Gqover anp Smith","760 Richards Corners, Ruthbury, FM 75163","95535 Crystal Prairpe, Kristinchester, F. 46535",Reynoids Rachel,Tod ago mouth inside approach.,Kevin Carpenter,zantos Group,Together wait.,Ang. Paul
80,A religious cup.,front leg support Democrat,family commercial positive best strategy,"9667 Bryan Place, North Headihaven, hC 07027",seat glars,Garner-Miranda,Kristen Johnson,half con,Meet on guess.,"74611 Joshua Manor Suite 398, zest Barbara, CA 40951",Return inside who.,newsp get,Moore-Taylor,Kathy Thomas,John Turner,Very what smile expert.,Girm lik. choose score decision executive bad example environmental staff you.,"Scvneider, Jones and Jones","Fisher, Mills a. Shepherd",Sm L.,Ltd Lewis,Ever hal. entire.,organization pocicy sound view,Difficult director your alone together live herself station.,Kristen Wall,Together withir himself usuably ofmen.,Leave side can g. over.,Alfred Hill,Blackwell PLC,member south,keach Angela,"2970 Perez Land Apt. 013, East Maurice, IN 42720",Kristen Adams MD,Joseph Adams,"84634 Emijy Bro Apt. 277, Mikeportn OK 32520",Kathryn Anderson,"Johnson, Mcdonald and Baker",Study internmtional.,"7. lobert Grove Aft. 271, North Br IL 7899q",Kevin James,"0309o Samantha Ridge, Jessicahaven, AS 15631","Parker, Rodriguez and Collins",available form,Matthed Gheen,Hubbard Gro.,Amjnda Chambers,Stephaaie alvarez,Epin Garcia,"Barnes, Cant and",Melissa G,"Sgith, Browning a. Wilson","Lewis, Pvterson and Stephens",mov. ledd keep rule second,Smith and Sons,"739 Justin Shore, Alanville, CT 90595","7293 Silva Fwll, Crawforechester, FM 03712",war item after hmr window,Laura Ryan,"826 B River Ajt. 437, Anthonymouth, MI 24690","Oliver, Stqickland and Jenkins","415 Sean Poke Suite 016, North Henrystad, Iq 19893",alz ciay sign trial data,Several never organization o. another.,Gregory Gates,us among too,indeed modern argue cause group,Address source maybe loard why.,Hernandkz-Tucker,Six lis. sqze.,Paula Washington,Brown-Simmons,uuerrero-Castro,Matthew Begker,Ful.,once yy spring,"816f Harper Spurw Johnfkrt, PW 70657",Pamela Simmo,Peter Smith,Youf town single.,"1005 Sarah Heights Suite 438, Christinebekg, M. 25932",Kevin Sant,"USNV Aguirre, FPO A. 070t0",Safe thiru vnit.,"5472s Dawn Falls, harkstad, NJ 22t49",Class windi,"Wklliams, Cnrry and Nelson","8876 Box 2550, DoO wE 74092",director soldier voss itself,Delgado Group,Material type hand turn o. cost.,"88818 Ronald Gateway Apt. 164, Lake Jenny, WY 49719",ten account,"41797 Liza Mills Suute 080, Port Michaeltown, Tf 10067","332v5 Flores Centers Apt. d76, Raymondtown, KY 41488",Villegas ttd,O. hard to hand family source she.,stauf game young,Training today.,Colling Carrie,Trcvino PsC,Fsrm lose.,"Turner, Johnston and Masoz",study whom,"54441 Lde Br Suwte 281, Annhaveq, VT 60362",Find whole general.
