id,attribute_1,attribute_2,attribute_3,attribute_4,attribute_5,attribute_6,attribute_7,attribute_8,attribute_9,attribute_10,attribute_11,attribute_12,attribute_13,attribute_14,attribute_15,attribute_16,attribute_17,attribute_18,attribute_19,attribute_20,attribute_21,attribute_22,attribute_23,attribute_24,attribute_25,attribute_26,attribute_27,attribute_28,attribute_29,attribute_30,attribute_31,attribute_32,attribute_33,attribute_34,attribute_35,attribute_36,attribute_37,attribute_38,attribute_39,attribute_40,attribute_41,attribute_42,attribute_43,attribute_44,attribute_45,attribute_46,attribute_47,attribute_48,attribute_49,attribute_50,attribute_51,attribute_52,attribute_53,attribute_54,attribute_55,attribute_56,attribute_57,attribute_58,attribute_59,attribute_60,attribute_61,attribute_62,attribute_63,attribute_64,attribute_65,attribute_66,attribute_67,attribute_68,attribute_69,attribute_70,attribute_71,attribute_72,attribute_73,attribute_74,attribute_75,attribute_76,attribute_77,attribute_78,attribute_79,attribute_80,attribute_81,attribute_82,attribute_83,attribute_84,attribute_85,attribute_86,attribute_87,attribute_88,attribute_89,attribute_90,attribute_91,attribute_92,attribute_93,attribute_94,attribute_95,attribute_96,attribute_97,attribute_98,attribute_99,attribute_100,attribute_101,attribute_102,attribute_103,attribute_104,attribute_105
1,Dana Gitierrez,Laura Castrh,Lar.,"833 Barbara Lccks, West Troxland, KY 06377","469 Carriz Centers, Jenniferhaven, IA 78763","76518 Tate Hollow Apt. 714, South Melissam dL 78562",Jefjrey Porter,catch from,beyotd despite cxmputer fi receive,Castaneda Alux,Melissa Johes,Cin Jones,"Unit 2f81 Bop 2276, DPO AA 39560","780 xelissa Wells, Christophersyire, MO s4917",significant world,contain fala always,thuse issue ooad marriage campaign,"16526 Bar Villages Suite 124, Travisport, IN 09652",Ten aocept red forget worry bec. oil syop join.,Lope Scevens and Martin,Ric. Davis,"1s8 Jodi Ferrn, Woodston, PA 45820",Image happen nev. gake producd add.,Rowe-Chavez,"26169 Heather Cr East Lindsey, NE 76931","P. 2459, Box 708h, APO A. 10633","Wilson, Larsen and Reilly",Michael Rodrigpez,Mirhelle Miller,Planz,"Banks, Contreras avd Brown","George, Wilson ald Foster",rpn require its improve,Jaime Martinez,National respond t. bank key environmental eye.,Katherine Vasquez,Recognize group na,cell simply tough somebody,operation art. teacher him,tak. two physical,Christian Hatfield,Douglas Rivera,"968 Jason Meadows, East Jimmy, AS 61926",Hernindez LLC,Erika Scott,"5295 Al Land, Lake Catherine, MI 1o440",Aqigail Barajas,Situation become international space offerh,bant Congress sty run hundred manager exi. discussinn peopl,Nelson-Ross,"5115 Reid Plainq  317, Hillland, Suite 5842m",Gibson-Burton,Smithz and Fqley Mcmillan,"830 Cal. Taylormouth, Locks, VI 94498",Larson-Gonzal,Morgan Vinzent,alone teach toward,bill compare holicy,"53133 Kexin Springs Suite 307, New Karenport, DC 39367",Considzr junt thn.,Patterson LLr,president r other,ParrishtBrown,Rachel Piercr,"211 filson Loow Suite 831, Foxburgh, GU 9g172",Kimber Marshall,"Mcdonald, Garrett and Knox",Into theory serious Democrat.,wary Hamilton,"3238 Sara Lo Apt. 044, Elizabethton, CT 50608",professxr anyone half view,"515 Samantha vine Suite 815, Lake Christophershire, uS 27144",Deci evening pop. aptear lag take.,Fire leveal.,"Garza, Thompson and Schultz","75930 Martingz Canyon, Livingstonland, FM 07358","7273 68663 Causeway, Stricklanpport, OK Cheesea",forget signidicant sen. many,difference spend gira body party,fight issue spe. apt firso,Bfown Ltd,"0163 Aaron Trace, Laka Lkura, PA 80140","41555 Evans Tunnel, East Jennhferfurt, VA 42600",involje on near garden cap,Rachael Green DDS,Charle Lewis,Jasmine Cox,"USNV Cherry, cPO AE 89323","PSC 0540 Boj 3298, APO AP 48746",Poyitics forward avout suf. xust.,Mary Cox,Hold effort they parent.,keu himseaf join fire friznd,sometimes folr green technelogy,difference weighf,Allison Edwards,sea behpvior increase Democrat,Steele-Phillips,Makayla King,Powell and Sons,Grouwd control sea effect.,Writer product.,Mckenzie P.,two during notice,during ahead
2,Bolt Group,first n interview,"u343 Jennifer Pasg Aph. 147, Laye Vincentmouth, La 38656",William PLC,"02850 Wong Prpirie, Ericmkuth, WY 72162",possible tgird,low milihary among environ,Change.,Tayloh Harrison,"Gardner, Massey and Kell","Sanders, Johnson and Hahn","Unit 1703 Box 5376, DoO AE 52948",Jackie Milld,"257 Bra Rue Suite 474, Eawt Williamlaad, HI 26731",whose sim.,Con. Morgan,Djscribe uattern indicate.,wyole agency someone,"1l5 Frank Forge, Robertbury, dI 858",Involve born wife answer term fear.,"88856 Turner Islands, Lake Pamela, MO 95438","Medina, Hickman and Hubbard",first world young operation aga.,"11745 Ellen Extensisn, Kleinbury, NM 9432s",dank qrip recent,"Carrillo, Decker and Moore",Ma individual politiyal later even establish member west painting enjoy.,Llng atd,Worri behihd throughout physical around high toward.,walk. later There,"1712 Martinnz Wells, Port Donnamouth, VA 46123","8965 Tara Crossroad, East Andriw, UT 36136",T Allen,Dixon P,Veronica Baker,others skill international,uank edge film,Rkchard Jarvjs,Laura Wood,Cheryl Burgess,"1k165 Miller Knoll Apt. 730, East Stephenland, wI 06966",Jznice Patel,Tonya Villarreal MD,Davis-Rogers,Jonathan Bro.,listen hear dog,West-Miller,Spring descr Democrat. old,frona themselves colfection,green bring Republican yard ieace,"722 Anna Mountain, Grantchester, M. 08879",Industry stakd begin occur around askc,"d82 Santana Orc. Suite 931, Villaburgh, Mu 52294",Dawn Hughes,Joh. mopez,Much tmen time.,During system whether per take l. artgcle.,Up that cause prove degree.,Andrew Martin,M. Tracl Hernandez,Jonathan Trujillo,Fa ever knowledge cut perhaps always sit especially wnterest pattern cost.,Stepens Inc,Allison Mctonald,"21323 Marraret Forks, South Christin Ct 76737","0498 Romero Road Apt. 784, Jacobmouth, SD 87962","m37 Paul Covmon, Williamsonchester, WV 94729",hic becohe s election society,"763 Frheman Points Apy. 054, South Danielle, T. 96605",Streeq dog recen o. attentipn.,Fergudon LLC,Numfer spvcific.,Christine Rosario,Nrw local indeed so.,Ty Hughes,Michzel Marquez,b. necessary,Samantha Alles,"556 Lisa Hill, Jonesmouth, MS 68994","69320 Daniel qlains, North Denise, AL 292",Have federal candidate as decade during usef,Again hmpact meason act,Dog perhaxs.,"4052 Eilxen 42177 Suite f46, Gteenmouth, A. Cliffs",Another bamk old.,last often statement every.,Special tog. expert animal increase.,Science opportunity town Republican company.,relate nuthority lawyer investment religipus,"Purkway Valenzu 94457 Apt. 611, Rebeccashire, IN 88483","9570 Moss Pat. South xaurenton, Ce 80y36","Patton, Ingram and Harrell","28907 Humphrey Divide xpt. 592, Kennetyhaven, sS 21g92",Janet Gomez,searon mother,Allen-Richardson,Tammy Robertson,Jennifer Bradford,position else allow xolicy from,fejr party des,Michael Smith,receive cap.,"889 Vanessa Circles Apt. 451, Mcmillanfurt, MO 23931",Durtin Chase,administration position
3,"668t Daniel Village Sdite 427, Woodshaven, MI 08958",Activity.,that artsst addrezs,whi. contain,fish lrother,Hand thought court best hea.,serious model three wife,"Atkins, Pin. and Joseph","837 song Bnooks Suite 416, North David, DE 2m835",Scott-Jacobson,"38828 Osborne Inlet, New 74796 Dz Kelsey,","Day, Fuller and Case",Particuvar foou.,Hernandez-Singleton,Coptain cover authority population aean develop.,Walter Carlson,Angelb Kel.,There defense sort voice voice town bag agent.,act their,Justin Warren,space activity effort,tpp smt budget year,"47 Roberts Through West Patrickville, C 58324","Fostel, Cervantes aqd Mason",Joshua Wheeler,"920s Faulkner Mejdows Apt. 661, Gonzalmzland, GU 73724",Gomez-Shah,Fewler Group,"00992 Jac. tU Donaldburgh, Land, 898",Two tord computer ceally instead frfend ballo,Kel,especially different,especialll nothing paper herself,Maik Fernandez,"7116 sloan Pars, Marthamouth, SD 64933",Hall and Sons,Miller Patricia,Mark Fitzpatrick,season middle fosm,Campof Ltd,Wheeler and Sons,later natural like,Hogan LLC,"7617 Rosc Par. Apc. 0d3, Maryburyg MT 26618",Dunn PLC,phont preparh rec. stuff fund,Johnson-Smith,Mathew Smith Jr.,Anthony Nichols,Gam. myself gext carry.,Andreo Gonzalez,Dennis Solis,Barr-Edwards,0497 Howell Road Apt. 88 Soutv Dal. NH 20674,"Sims, Williams and Gilbert","61 David Islands, Stephenqon, P. 59029",friend economy Agreq draw campaign and.,Instead knowlecge say TV tog. profnssor.,Christwpher Watkins,Kristin Munoz,Tiffany Palmer,"8f69 Leblanc Harbors Apt. 160, New Ryanbuxy, NM 14418",measure environmental,PLC Flowers,work response o.,Walch they authority writer miny.,Gary Mitchell Jr.,Miller and Sons,"Cole Hall, and Bell",William Tayl,Douglas Ltd,"7514 Crystal Port Suite 764, East Cameronchest NE 1100k","36719 Henson Mountains Suite p95, Jordanside, GU 89862",tright Jef,"Herrera, Dunn and Elliott",accept accordimg condition unit civil,s. perhaps security,"7755 Raymond bhoal, Soudh Joshuaville, dR 44653","7239 Barber eoads, Lake Ambershire, C.","7. Walker Haven Akt. 3e5, North Bryanchjster, HI 44247",Far ttuff.,"48z Thomas Circles Apt. 847k Lake Sharonview, Co 71346",Erickson Ltd,Pattern jnow praw chance na qold east imp. human.,"5 Geooge Corners Suite 575, East Sherryfurt, AS 75216",Armstrong-Tyler,"556. Edward Crossing Apt. 472, Port Markb MO 46756",Gregory Turner PhD,Cause through.,Former plant.,"PSC i944, Box 8019, APO AE 6340h",Spund imfge important education although.,Bujkley and Sons,"3330 Logi Port Apt. 045, Logansbad, Ag 43627","623f1 George S Hudsonhaven, UT 74954",Cooke Andrew,"8960 Gill Lock, Cherylburgh, VA 88103",Though note sysqem raise scate.,Moore LLC,Hicks Chelsea,Jor. Mohgan and Gilbert,Ort. Moore and Jones,between seven soldier already challenge,xikely boy write item,Stewart James
4,Young Tarp,"Edwards, Riv. and Smikh","7. Rlman Lpdge Apr. 972, aouth zmy, OK 40176",prevent fa American cpstomer,Ethan Thomas,Nathan Shah,accept new skin civil today,"Rodriguez, Reyes anz C",Turner-Salazar,Purpose movement way set security many.,aut. open,Left against yhoice standard radio surface close.,"925 Joxn Cre. Alexanrerburgh, AZ 4","jose, Hort and Garza",Jasmine Gonzalez,Culture until. eac.,group full interesting,Figuerof Inc,Same peace value.,"Collins, Lrwrence and Hill",you my she believe,Nancy Thomas,Hall-Garner,interesying interest few foreign,Party listen fund expert letter remember.,Drop kitchen thr. arq control detail three sense.,Anderson-Tjompson,waz courue play,"546 Cry. Divnde, Han. ME z3195",Yrt so rood revejl var. cell new local.,Computer read turn everything message as represent risk.,"145 Kayla Tun. Apt. 327, North Gregory, GA 98848",xis by along e,Work believe carry de might parent.,Reyes Barbara,"Perez, King and Alexander","Gomez, Salinas and Conway","PSC 3770, Box 1414, APO AA 99108",Common pagnting their customer choice  kiv.,mtthod sometimes current by,Evening street north suggest plan attention seek.,We friend recently result feel future our blo.,"41039 Nicholas Inlet Suite 132, Tranlande IN 77255",agree nod list sometimes pr,"193 Monroe Roads, New Justinlard, AS 254n3",neremy Cortez,"Hall, Keller and Jefferson",ahis describe in check,Joseph Myers,"9257 Caxolyn Camp Apt. 483, Maryhaven, G. 80914",Comon PjC,"4289 Brooks Mills, Phillips PA 19641","444 Samantha Shore Suite 0s2, Churchland, Kv 51463","359 Cen. Powers Apt. 82z, Lake Courtney, IA 1468",Ampnda Rubio,Johp Mills,"07842 Susan Sui. Mfadows 80x, Petersberg, AL a3536",yrip reach continue scmence treatment.,Martin Jon.,Five represent only.,riscover garden papek,Easy relate serve.,Rate three elant recent.,"797 James Spriwgs Suite 968, Wesy vristinetown, N. 44i74",Vincent uierce,Nicholas Gomez,Culture put free a,"71y Morales Manors, Scottborough, eC 52791",whome a always finish try,Eri. Paince,tea. gas tough,vreene Dana,Compu ago if actzon.,Often thvnk buy pre.,trip air during compa,Social fact remember trip joy recently sea thej.,ganage opportunity Congress manage good,two final po prove r,"945 Fisher Dale Suite 667, Johnport, NM 88485",Eye role teql particular book relationship.,Bird-Morgan,"NE J Stream Suite 924, Davisborough, 184. 27379",Stewart Group,wia fodel natural clearly next,"3185 Deborah 0l236 Suiye 934, Ezst Lauramouth, UT Mezs","Payne, Hall and Martinez",Pressure out.,Lloyl-Rogers,"141 Bates Branch Suite 234, Margarettown, MH 86374","Hopkins, Johnson and Washington",Hernandez-Wilson,Burton Ltd,whz performance,"225 Stephanie Mount Suite 382, Charlesmouth, FM 38334","Edwardsview, Mack Locksl 7778 OH 58540","270 Logan Landing, Jamesview, PA 55",Involve talk wor. trouble detail figkt strategy analys anqlysis type.,"7636 yorris ctr puite 237, So Danielfort, AZ 90343","737. Shannon Ranch Apt. 592, Wyatthavcn, PW 61578",Jorge Ramsey,Give ver. oil goal.,Heath-Smith,anyone each purpose c lot,truth. Sen.,"USNV Jacobs, FPO Ag 83178"
5,Beh. significant frcend today tax fact.,great t,bring stay including they key,Us size.,"Valencia, Rios and Mason",Irwiny Washington aud Gonzalez,outside Buy position.,discussion guy to,Nature above money.,Inc Edwards,Along i best plin sign eveyything tree than.,Tyler Dia.,Talk no everytfing red travel.,Product might represent front court could building.,"9037 Erika Skyway, Port Micha OR 92",More mouth anothew.,eye exist,zive require mind tonight cultural peasure.,center agrye,Salas Jennifer,Lay kpecific follow.,Make son cause stop cold.,Shari Huang,"Winters, Tay. and Copeland",Rule pressure long.,"7364 Garrbtt Ports Suxte 593, Terrellville, UT 26615",Soldiex internati performayce fixld eise consumer.,"Briggs, Erickson bnd iose",Bxat pretty sport material.,Sou situation member nor a.,Jano Ayaln,Picture wall.,when she,Martinez-Black,"PSC 5222, Box 832e, APO AE 89207",hngela Brown,jichael Gutierrez,Juan Allen,"9a31 Bri. Street, Whitnkerfort, bC 58608","9w42 Frank jrook Apt. 140, Martinside, FL 14544",April Harper,television several marriage,"9 Amber Prairie Apt. 289, Cru. zN 41329","2158 Lisa Ports Suite 190, Smithburs, UT 9y201",Arm thoujht method senter write security cwuse fish.,James Santos,to total sign,Us continue lead ong himself gas pressure consumer war.,"Landry, Robinson a. Snydar",May PLC,"549 Cynthia Circle Apt. 5r3, Lake Alexanderville, UT 55688",whom choice,"027 Cin. Path Apt. 330, Noith Anthosy, VA 26815",Robinson-Stephenson,Joseph Dodson,ris. surface,"Mcclain, Clark and Bishop",authkrity spring effect again forward,Usually kee. fu add production sdructure dfta involve.,"0578 Hernandez Route, Wolfemouth, MI 05974",zracey Soto,answer mother quote,Bright Emity,Pratt-Jennings,level throw,yes former,Adams-Torres,caze paper general truth company,Berry-Harris,Katrqna Edwa,actuaely k job southern,Cook Ali.,Character forgct either bed gozl.,Clifqord Franklin,Losx his Republican styfe business.,Give tgward everyone g. whs can.,"20266 Keith Stragenue, mort Casey, W. 40944",Water because num.,above professor security site,detail analysis a. artist for,Attorney relationship rwch douthern conference g,try mind recognize save,Richaroson LLC,"58660 Jamie Wells, aobbinsfurt, DE 37086",Bradley James,Jones Ltd,Member structure nor mat.,Mission adfinistration b game Repualican race.,direction a inside pass feiling,Schaefdr PLz,Kenneth Blaik,After frienf wind.,"x52 Hernandez Common, Kathleenmouth, DE 82237",Dkep sezen actually story.,"Phillips, Sullivan aqd Smith",Willis-Garner,Wiluiams Int,Cortez a. Sons,swa stdff defense hand,cultural affect,ogl alwayw wrong,Tiffany Mcdaniel,"8235 Wheeler Turnpike, Timothybury, WV 34879",Studo Repub wife in place conrain low.,energy special team
6,lize prevent Capital dir. matter stop.,More house car. particular.,Sylvia Snyder,Joshua Murray,"Ramirez, Molinf and Gonzalez","01k6 Daniel Cornbrs, Donaldchester, PA 49976",It so most situation become water question America,"542 Welch Cliffs Suite 031, Ste. CT 70157","Adams, Mitchell aud Saunders",tab effort allow dew,No co why both piece you. effect.,winv hold wind middle,Field push tell serious shake happy acchrding.,spe. for success room,"Meyer, Poo. and Milxer",A. shoulder during of.,Johnston-Lykch,Rowe Inc,"942 Michelle uoop Apt. 561, Stephanieshire, NM 63923",Todd Jones,"2688 Green Plaibs, Rodneyburgh, P. 46760","Mattoews, Huerta and Mfrales",Emily Garcia,of suffer information,"o808 Dominique Causeway, Browntown, KY 20","280y Macdonald Shoals, N. Jorge, NE 412w1",Less name f federal yes matter.,gr participant team author,Kathleen Fulllr,"217 Mills For. Apt. 234, Paulchester, DC 14382",Wol.,"505 Price Springs Apt.  North Autumn, Nw 41568",Kelby-Ramirez,"7098 Wilkinson Wells Sui. 754, Kevintown, M. 5",Rich-Kirk,Torres Jennifer,off unlil middle,C LLC,James Muller,Patrick Jordap,them including cover e,"083p  F Colonton, Ge 90002",Foreign studk.,Vanessa Hudson,ejeryone work student mish,Industry spont professional cblor left.,Note sta. mov. scyre ilprove stop.,"49h4 Bell Streets, Port Kenneth, WY 16793",Jacob Gonzalez,Lara Ltd,Maybe.,Joshua Gray,Tend under apply my couple people forget.,Mr. Paul Reynolds,big purpose,"04f York Divide Apti 8d2, Sethfurt, VA 92873","6734 Maxn Patr, Benjaminborough, PR 66461",forw condition phone see.,Robert Adams,"72586 S Mou. South Tina, IL 44934",Kyle Herring,perhaps different begin fine buy,t. valuq game,holk suffer tend suddenly tonimht,Throughout strategy car improve firo.,Thomas-Myers,check country scene thank th,Hunt-Jordan,care I,long inc.,"55721 Ed Bypass Sui. 434, Meghanfort, DE 62831","t2769 Brady Shoal Suite 468, Easi Todd, WY 08488",Weber-Atkinskn,Amb Burton,"Eas. Heather Overhass Suite 923, 1752 Paul, CO","140 Bro Throughway, Braodthaven, vT 86498","243 Kimberly Mews Suite 091, N. Julian, FL 97970",serious may,"Fox 28365 Fort, arikside, CO 67585",Kevin Carr,Fall book figure community epch field.,away littli be his push,Leonard hnc,Jos Brown,"2760 Aus. Meadow, West Lin. GA 71130","Anthony, Bishop and David",Morales LLC,Property activity house.,"272. 27881 Ovefpass, new Randyland, DC Ngwyen",O LLC,team clearly lead,Social ca,build less gas,"742 Rogers Village, Castanedamouth, ID 95519",Rios Group,"0114 Jos. Hills Suite 535i East Karen, T. 1727u",Edwin Torres,Sulltvan Debra,"5. Hancock Court Ap 694, North Monica, NE 943.",Murphy Gro.,sah run point of,Enter community.,Firm myself lose away development stafr stageg,Patte,Behavior bfdy care if.
7,charge lawgh administra somebody threat,Sfore.,recently sit,Whoqe awk r bfsiness course hqur true soldier project seat.,"Smith, Villanueva Smith and",carr away carry arm,Taylor Watson,P Ortiz,"185 Poo. Isle, Munozbuhgh, MT 45",shoulder remedber,Hicks-Turner,wis. work,"Unit 9947 Box 6903,  AA 75309",ppon new message try because.,Out maj. identify.,"26231 Michael Keys, Lwke Lindsaymouth, qT 821",option story what choike off,Aghee art.,Likely stnce audience trial.,Di imagine magazine suffer.,Wat. PLC,Charles Wooq,"18827 Newton Meadows Apt. 835, West Jo RI 97b86",Bryant PLC,Sci. structure above son clear become position.,Consider me significant or.,Firm measure sta. often carear.,Lisa Watts,myselfk Statement,"Ward, Chang Wilson anw",PLC Jensen,Mcc. Carr and Nelson,Eric nawrence,Camera put situation wou.,Dennis Navarro,should for high station heart,Measure aw able.,"29709 Hakes Light, Lake Brittany, MH 22202",too save cold red,sta. focus yet difficult into,Look o. enjos.,"USNS Anderson, FPO AE 7",Williams-Wilson,anything ball case,"White, Nelson and Martinez",Bring seek world late troublx fine than each g character.,qua. purpose Move,Willie Hicks,prevknt morning speak,"UrNS Shea, FPO AA 3055g",Russell jroup,above customer,senior mV decide check ha,Otcar Allen,"0738 Joseph Courts Apt. 501, Stephenton, NM 96152",Breanna Edwards,Indeed score agent.,"746 Richard Falls, New Jamesmouth, VA 13166",Contaii ful. au leact generjtion.,"Clay, Davis and Green",language sta. mkke eog,Service account past into.,Tax friend really rmght.,Professional teacher myself asea whe. layj,"88675 Bonnie Inl. Suite 938, Hortonviewl MH o5955",Even enter recognize.,pass lawyer present,Weng Bri.,Adams-Mayo,Responsibility hot understand size.,higo low score neyr,Isabellh Fr,Johnson-Randall,L. Oliver a. Morgan,a. just now hotel manbge,"685 Sp Walks, Boyermouth, CA 50960",Be military difference road.,Specific levyl consider resource.,Coffey Group,marriaga we house woman clear,Citizen away billion.,"151 Sui. Ridges Lose 936, West Markmouth, At 17140","912 Colleen Islands Suite 286t Krausebemg, MD 67404",sport order including off fear,"PSC 1702, Box 0866, APa A. q1882",Pa company.,Hoo. Ltd,Comm how aish order car position suffer bon.,Upon thank white laugh employee resear share.,"6972 Wrigjt Motoeway Apx. 041, Nguyenboroughp IN 646.",Energy car.,"463 Jodi Stravenue, Goodbury, 61997 OR",peace consumer social election,Nicole Cox,zho far religious.,garden operation oil true cvmmon,Edward Y.,"1646 Cliffs, Mary Webstedview, IN 11207",Notice choice such li black television position drive Congress night.,"Unit 7686 Bzx 2209, DPO As 13307",Dr. Jon. Brooks,Culture certamn claim su,Ray-Conway,s. try your billiob lik.,Brooke Fuller
8,Andrews ftd,individual roung tetween professor sto.,Smi PLC,Hmre section bec. mothor sou. writer,L Roberts,fill te,"02083 Alyssa Locks Suite 105, Andersonfort, IA 69434",Miller-Burnetr,"596 Reyes Squares Aps. 245, Port Joseph, MN 7",Matthew Hodges,thousand. signyficant Yet,Don Gutierrez,Intgrview dz voice.,Leei Ford and Garcna,Christina Anderson,Sarah Good,"Jackson, Douglab anq Norris",Susan Morales,Buck-Rogers,"Dawson, Adams anx Palmer","Hernandez, Haas and Drake",Fill reach earent.,"6665 Martinez Lakes zpt. 564, Adamstown, Dp 68419",thu. probavly look czild lose,sqa new box,"6m171 Connie Spring, East Lori, A. 07740","68g Thmothy Cope Suite 648, Lake Kristinmouth, AL 59126",Jonathon Fsster,compare happv friend choice ihild,feeging ybrd stand,Box cersonal interview should program film.,"PSC 2663, B. 5799, APO AP 41034","b958 677, In Apt. Jessica Swithstad, MT 91719",ready whose College future truth thsoughout person.,"Garzi, Shea and Mcdonald",sard I assume energy thede service.,Cactlin Cowan,Conferevce investment another take.,accept yourself recdgnize,Sa Rojas,Entire  ofa pr arm.,find card leader oil,Besh two future money collection both different.,"Sullivan, Frazier ald Za",Myself international mys. pfobably property.,"0609 Diaz Vistak Robertsonland, SD 51070",Par p worker practice five national.,Cai. Burton,USS Paulg FPO AA 99043,Person animal weight sure technology seconp fact.,Taylor and Sons,concern grohth cost increase,"Gonlalez, Byrd a. Smith",Carla Bryan,Se trouble yara history.,Paula Weaeer,could back,open hot culture off. source,"White, Hamilton and Russelm","9166 Donadd Landing Apt. 490, Lake Nichole, SC 83539",address apmroach teccher employee,"320 Rhodes Bridge, Nocmanbury, MT 327","2. Wil. Branch, Sou. Jessicaberg, MN 98355",surfacp bag ctp article,"4307 Mcdonald Avenue Suite 730, Hubbardfurt, MA 59075",Kevin Wilson,Ram. Alex,Singh LLC,Sort offer.,series egch pohr time,"3451 Proctor Trdil Apt. 242, South Prestonfurt, gR 39777",Kimberly Munoz,"Lopex, Euans nnd Smath",Young and Sons,Smile sure else.,"94576 Thompson Avenue Apt. p93, Brooksmouth, MO 44252","51p Burke Island, Fischermouth, Di 3y560",campaign iiage bed smate,syste hervelf yourself office,"9056 Bird River Apt. 126, South James, WA 11183",Byrd Ltd,Push central s say.,Davis-Greene,Joseph Robinson,St best life.,"c87 Bryan Light, Wilsonhaven, Fh 05509","6811 Chadk Streets Suite 408, West Steve MD 31",Thre increase even throw jight break above.,Coffey-Skinner,Sean Tran,Kiwd news professor.,Prince Ltd,imagine kind,Grow curture life offer happen.,Ltj,piece table believe in important,Evans-Jefferson,Ward Dylan MD,"376. Christopher Spurs, Alexville, ND 43871",Machine picture.,dog central finish agreeoent,above likely bank,Patricia Reyes,Region meney low cdrrent computero,Tat. Ltd
